	summarized	lineages	abundances	resid	coverage
07_08_24_ENCJUL03_R2__E0000000__X00__240712_2_SG_WW__001.tsv	[('JN.1.7* (JN.1.7.X)', np.float64(0.6107929984877082)), ('KP.3* (KP.3.X)', np.float64(0.24665669238403992)), ('BA.2.86* (BA.2.86.X)', np.float64(0.08959330801582635)), ('KP.3.1.1* (KP.3.1.1.X)', np.float64(0.04057190046707399)), ('KP.2* (KP.2.X)', np.float64(0.012358549694000283)), ('Other', np.float64(2.651420872278454e-05)), ('A', np.float64(3.984208915884711e-08)), ('Iota', np.float64(2.9677385241849746e-08)), ('Delta', np.float64(1.3813510044740634e-08))]	JN.1.7.3 KP.3 JN.1.7.4 KP.5 KP.3.1 KP.3.1.1 KP.3.3 KP.2.3.3 KP.4 KP.2.15 JN.1.29.1 LM.1 KP.2.2 LE.2 LP.3 KP.3.2.4 KP.2.10 KQ.1 JN.1.27 KP.2.16 BA.2.86.1 KP.2.9 JN.1.7.6 JN.3.2.1 LE.1.2 XDQ KS.1 JN.17 JN.5 KP.2.3.2 A.2 B.1.526 AY.54 JN.5.1	0.52634792 0.17778365 0.08437172 0.08133933 0.05641480 0.04057190 0.01233260 0.01142051 0.00687830 0.00043343 0.00037986 0.00021221 0.00018979 0.00018372 0.00015427 0.00012565 0.00012550 0.00012013 0.00010868 0.00010669 0.00009084 0.00008253 0.00007336 0.00006506 0.00003920 0.00002651 0.00002114 0.00000030 0.00000027 0.00000009 0.00000004 0.00000003 0.00000001 0.00000001	8.571125519951664	97.38822191753336
07_08_24_SBJUL07_R2__E0000000__X00__240712_2_SG_WW__001.tsv	[('BA.2.86* (BA.2.86.X)', np.float64(0.7324612803925774)), ('KP.2* (KP.2.X)', np.float64(0.17551803829042464)), ('LB.1* (LB.1.X)', np.float64(0.06249999455256172)), ('KP.3* (KP.3.X)', np.float64(0.016755496091341297)), ('KP.3.1.1* (KP.3.1.1.X)', np.float64(0.012307400127055224)), ('Other', np.float64(0.00020872414050981933)), ('JN.1.18* (JN.1.18.X)', np.float64(0.00015167038913839936)), ('A', np.float64(6.6348150680198e-05)), ('BA.2.75* [Omicron (BA.2.75.X)]', np.float64(3.103728233377518e-05)), ('XBB.1.16* [Omicron (XBB.1.16.X)]', np.float64(5.106328631525622e-08)), ('XBB.1.5* [Omicron (XBB.1.5.X)]', np.float64(2.0811836486504648e-08)), ('Omicron', np.float64(1.735024931124145e-08))]	JN.1.40 KP.2 LB.1 JN.1.11 JN.1.16.1 KP.2.3.2 KP.2.3 KP.3.1.1 KP.3.3 KP.3.2 JN.1.1 LB.1.3 KP.2.8 JN.1.4.4 JN.1.47.2 JN.1.25.1 KP.3.1.2 KP.3.1.4 LB.1.7 JN.1.1.8 KP.2.15 KP.3.2.3 KP.2.13 KY.1 JN.1.4.8 LA.1 KP.3.2.1 LE.1.2 LB.1.6 JN.1.34 LB.1.5 KP.1.1.4 JN.1.47.1 JN.1.50.1 JN.1.29.1 KP.3.2.2 JN.1.2.1 KP.1.1.2 LF.3 KP.3.2.4 JN.1.8.2 JN.3.2.1 JN.1.51.1 JQ.2.1.1 JN.1.3 JN.1.18.2 LB.1.4 KP.2.16 JN.1.13 JN.1.23.1 JN.1.52 JN.1.48.1 KP.2.9 JN.2.4 JN.1.55.1 LE.1.3.1 JN.1.10 XDT JN.1.23 XDV.1 JN.1.8.3 JN.1.49.1 KP.4.1.3 LS.1 JN.1.6.1 KP.2.2 JN.1.17 LG.1 A.2.5.2 KU.2 LP.3 XDQ.1.1 JN.2.2.1 JN.1.2 KR.1.1 FR.1.3 JN.1.5 KR.1 JN.2.5 B.1.641 A.2.5.3 JN.1.54.1 JN.5.1 KP.1.1.1 JN.1.19 XAW HW.1.3 JN.1.41 JN.1.48.2 JN.1.27 KP.2.3.3 JM.1 B.1.622 GK.1.8.1 JN.1.39.3 BF.5.3 XDD.1.1.1	0.64966678 0.12359992 0.05900313 0.03898592 0.03489584 0.02709561 0.02202500 0.01230740 0.01222720 0.00291834 0.00276740 0.00269633 0.00197461 0.00064446 0.00062906 0.00049977 0.00045721 0.00037421 0.00033408 0.00031612 0.00031111 0.00030138 0.00028842 0.00027402 0.00022913 0.00022021 0.00019581 0.00019572 0.00019396 0.00017631 0.00017572 0.00016039 0.00016036 0.00015762 0.00015455 0.00014862 0.00014339 0.00013802 0.00013704 0.00013272 0.00011381 0.00011263 0.00011171 0.00010794 0.00010670 0.00010400 0.00009679 0.00009620 0.00008889 0.00008711 0.00008544 0.00008438 0.00008018 0.00007776 0.00007743 0.00007229 0.00006598 0.00006264 0.00006234 0.00005891 0.00005428 0.00005261 0.00004862 0.00004767 0.00004732 0.00004670 0.00004560 0.00004540 0.00004335 0.00003898 0.00003859 0.00003539 0.00003234 0.00003223 0.00003161 0.00003104 0.00003074 0.00002951 0.00002504 0.00002474 0.00002300 0.00002198 0.00002121 0.00001752 0.00001467 0.00001408 0.00001292 0.00001111 0.00000976 0.00000561 0.00000029 0.00000005 0.00000003 0.00000002 0.00000002 0.00000002 0.00000002	7.633302796267971	98.02360967127044
07_08_24_ENCJUL05_R1__E0000000__X00__240712_2_SG_WW__001.tsv	[('LB.1* (LB.1.X)', np.float64(0.4923629419769405)), ('KP.3* (KP.3.X)', np.float64(0.3865389870480032)), ('KP.2* (KP.2.X)', np.float64(0.10432377148191642)), ('KP.3.1.1* (KP.3.1.1.X)', np.float64(0.015533997345524488)), ('BA.2.86* (BA.2.86.X)', np.float64(0.0011263217463948509)), ('Other', np.float64(0.0001141072808114622)), ('BA.2.75* [Omicron (BA.2.75.X)]', np.float64(6.896055171551507e-08)), ('Omicron', np.float64(4.806386336079746e-08)), ('XBB.1.5* [Omicron (XBB.1.5.X)]', np.float64(4.485858174698401e-08)), ('XBB.1.9.1* [Omicron (XBB.1.9.1.X)]', np.float64(2.971022208420606e-08)), ('Delta', np.float64(1.8724659394594617e-08)), ('XBB* (XBB.X)', np.float64(1.842973682506704e-08)), ('XBB.1.16* [Omicron (XBB.1.16.X)]', np.float64(1.015500912369443e-08))]	LB.1.1 KP.3.2.3 KP.3.3 KP.2.3.2 KP.2.3.3 LB.1.7 LB.1.3 KP.3.1.1 KP.2.3 KP.3.2.4 KP.2.15 KR.1 JN.1.29.1 LE.1.2 KP.5 KP.3.2.2 LB.1.5 KS.1 KR.1.1 JN.1.27 KP.2.16 XDN LF.3 XDQ.3 XDT B.1.177.34 FR.1.3 GK.1.10 EE.1 B.1.398 FL.11 AY.3.4 HU.2 BA.4.1.7 AH.1 B.1.563 JF.4	0.44314125 0.27854879 0.10762200 0.04939474 0.04939446 0.02613240 0.02296317 0.01553400 0.00519080 0.00023784 0.00022966 0.00018746 0.00018344 0.00017324 0.00015996 0.00013035 0.00012612 0.00012187 0.00012185 0.00011611 0.00011411 0.00008409 0.00006239 0.00001817 0.00001166 0.00000014 0.00000007 0.00000004 0.00000004 0.00000003 0.00000003 0.00000002 0.00000002 0.00000001 0.00000001 0.00000001 0.00000001	7.450027380338644	94.82995017222352
07_08_24_PLJUL03_R2__E0000000__X00__240712_2_SG_WW__001.tsv	[('LB.1* (LB.1.X)', np.float64(0.48358989226501514)), ('KP.2* (KP.2.X)', np.float64(0.2275419794064013)), ('KP.3* (KP.3.X)', np.float64(0.20330808235024875)), ('KP.3.1.1* (KP.3.1.1.X)', np.float64(0.0806968845129251)), ('BA.2.86* (BA.2.86.X)', np.float64(0.004165281814071627)), ('Other', np.float64(0.00048363586681843056)), ('JN.1.7* (JN.1.7.X)', np.float64(0.00021636456316727538)), ('Omicron', np.float64(6.613131465216946e-07)), ('XBB.1.5* [Omicron (XBB.1.5.X)]', np.float64(4.7400885206712017e-07)), ('EG.5* [Omicron (EG.5.X)]', np.float64(1.9218909399471848e-07)), ('Delta', np.float64(1.356464546889372e-07)), ('XBB.1.16* [Omicron (XBB.1.16.X)]', np.float64(1.2212913094674486e-07)), ('A', np.float64(9.850732642406897e-08)), ('BA.2.75* [Omicron (BA.2.75.X)]', np.float64(9.740627078751535e-08)), ('XBB* (XBB.X)', np.float64(9.406088257440672e-08)), ('XBB.2.3* (XBB.2.3X)', np.float64(5.7349066299699256e-08)), ('CH.1.1* [Omicron (CH.1.1.X)]', np.float64(4.278893363022247e-08)), ('Gamma', np.float64(2.496592779743933e-08)), ('XBB.1.9.1* [Omicron (XBB.1.9.1.X)]', np.float64(2.0837169186034767e-08)), ('Eta', np.float64(1.815742031603976e-08))]	LB.1.1 KP.2.3-like KP.3.2.3-like KP.3.1.1 KP.2.15 KP.3.1 KP.2.2 KP.3.2.2 KP.3.3 LB.1.7 LR.1 LA.1 JN.1.8.1 LD.1 XDK.3 JN.14 JN.1.7.4 KP.2.16 JN.1.4.6 XDK.4.1 JN.3.2.1 LE.1.2 LB.1.5 JN.1.55.1 KS.1.1 XDQ.1.1 KP.2.9 JN.1.27 B.1.438.4 B.1.177.34 GK.1.10 B.1.423 B.1.601 BQ.1.1.35 LB.1.3 HK.16 XDK.5 KP.2.10 KR.1.1 CK.1.1.1 JF.4 JN.1.16.3 AY.17 XAW XD A.17 FR.1.5 CY.2 XDK B.1.407 AB.1 LL.1 JN.1.7.7 AY.3.3 XAQ HH.8 KR.1 LM.1 JC.5.1 XDK.4 BA.2.9.1 P.1.17.1 B.1.36.33 XBB.1.20 XBC.1.6.5 B.1.641 KP.3.1.3 XAK KZ.1.1.1 BF.7.14.3 BM.1.1.2 XBT XM B.1.525 BG.2 B.1.258.22 FK.1.2.2 GT.1 KV.1 BA.5.2.13 GL.2 HE.1 CK.1.5 XDT A.21 FK.1.3 LG.1 A.28 CP.7 FR.1.3 KH.1 XDQ FW.1.1.1 FW.1.1 XDV FK.1.3.1 KV.2 JN.7 GJ.1.2.3 LE.1.3.1 XDY XBJ.3 HW.1.3 FL.24 HN.4.2 AY.70	0.48136095 0.16808298 0.15343995 0.08069688 0.03706023 0.02835608 0.02218227 0.01415136 0.00736066 0.00214707 0.00117302 0.00106206 0.00069246 0.00040034 0.00029502 0.00026945 0.00021632 0.00017082 0.00016414 0.00013855 0.00012306 0.00010975 0.00008164 0.00007746 0.00006946 0.00004738 0.00004553 0.00002367 0.00000082 0.00000062 0.00000047 0.00000031 0.00000029 0.00000025 0.00000023 0.00000019 0.00000015 0.00000014 0.00000013 0.00000013 0.00000012 0.00000009 0.00000009 0.00000008 0.00000008 0.00000007 0.00000006 0.00000006 0.00000006 0.00000005 0.00000005 0.00000004 0.00000004 0.00000004 0.00000004 0.00000003 0.00000003 0.00000003 0.00000003 0.00000003 0.00000003 0.00000002 0.00000002 0.00000002 0.00000002 0.00000002 0.00000002 0.00000002 0.00000002 0.00000002 0.00000002 0.00000002 0.00000002 0.00000002 0.00000002 0.00000002 0.00000002 0.00000002 0.00000002 0.00000002 0.00000002 0.00000001 0.00000001 0.00000001 0.00000001 0.00000001 0.00000001 0.00000001 0.00000001 0.00000001 0.00000001 0.00000001 0.00000001 0.00000001 0.00000001 0.00000001 0.00000001 0.00000001 0.00000001 0.00000001 0.00000001 0.00000001 0.00000001 0.00000001 0.00000001 0.00000001	6.31479714943503	97.17085242283383
07_08_24_PLJUL01_R1__E0000000__X00__240712_2_SG_WW__001.tsv	[('BA.2.86* (BA.2.86.X)', np.float64(0.41817513357495706)), ('KP.3* (KP.3.X)', np.float64(0.3388019947969825)), ('JN.1.18* (JN.1.18.X)', np.float64(0.10032543384675491)), ('KP.2* (KP.2.X)', np.float64(0.10012049514841635)), ('JN.1.7* (JN.1.7.X)', np.float64(0.04253419808947664)), ('Other', np.float64(4.274582203421251e-05)), ('XBB* (XBB.X)', np.float64(4.894704899619403e-08))]	JN.1.42.2 KP.3.1 KP.3.2.3 JN.1.18 KP.2.3.3 KP.1.1.1 KP.1.1 JN.1.7.3 JN.1.13 JN.1.2 KP.3 KP.2.3 KP.3.2.4 KP.3.3 JN.1.13.1 JN.1.53 JN.1.8.2 JN.1.45 JN.1.7.5 KP.2.15 JN.1.47.2 JN.1.25.1 JN.1.24.1 LP.1 JN.1.2.1 BA.2.86.5 JN.1.39.3 JN.1.3 LF.3 LE.2 JN.1.29 JN.1.6.1 JN.1.5 JN.1.49.1 JN.3.2.1 LF.1.1.1 JN.1.53.1 LE.1.2 LE.1 XDQ.3 JN.1.48 XBB.1.19.2 B.1.177.34 B.1.177.36 XBB.1.20 B.1.177.42	0.22009400 0.18915500 0.10298300 0.10032543 0.08093440 0.06487270 0.05406236 0.04189807 0.03272770 0.03105832 0.02249560 0.01861130 0.01244920 0.01171920 0.00781250 0.00130986 0.00100452 0.00093327 0.00063613 0.00057479 0.00050492 0.00048638 0.00035733 0.00035594 0.00029744 0.00025228 0.00024181 0.00022236 0.00020987 0.00019578 0.00017716 0.00017388 0.00016790 0.00014202 0.00012903 0.00010705 0.00010657 0.00010212 0.00006918 0.00004268 0.00000087 0.00000003 0.00000003 0.00000002 0.00000002 0.00000001	8.210807442751356	96.9033207370498
07_08_24_PLJUL04_R1__E0000000__X00__240712_2_SG_WW__001.tsv	[('KP.2* (KP.2.X)', np.float64(0.4514759661079069)), ('BA.2.86* (BA.2.86.X)', np.float64(0.25592925243507586)), ('JN.1.18* (JN.1.18.X)', np.float64(0.18265931904324542)), ('KP.3* (KP.3.X)', np.float64(0.09612698185238285)), ('JN.1.7* (JN.1.7.X)', np.float64(0.010380296798018523)), ('KP.3.1.1* (KP.3.1.1.X)', np.float64(0.0030821418399469163)), ('Other', np.float64(0.0003461522992824324)), ('Omicron', np.float64(6.320651999046738e-08)), ('XBB.2.3* (XBB.2.3X)', np.float64(3.284441529960898e-08)), ('CH.1.1* [Omicron (CH.1.1.X)]', np.float64(2.359586189995663e-08)), ('BA.2.75* [Omicron (BA.2.75.X)]', np.float64(2.0762487333238445e-08)), ('XBB* (XBB.X)', np.float64(1.3400608415895355e-08)), ('XBB.1.9.1* [Omicron (XBB.1.9.1.X)]', np.float64(1.0815772131268955e-08))]	KP.2 JN.1.18.5 KP.1.1 KP.2.3.2 KP.2.3.3 LP.1 JN.1.48 KP.3.1 KP.3.3 JN.1.13 KP.3.2.3 JN.1.7.3 KP.2.8 KP.3.1.1 KP.5 KP.1.2 KP.2.16 JN.1.58.1 JN.1.7.6 KP.3.2.1 LU.1 JN.1.7.7 KP.3.2.2 KP.1.1.2 KP.3.1.2 KR.1.2 KY.1 JN.1.39.3 JN.1.23 JN.5 JN.1.29 KP.2.9 JN.3.2.1 JN.1.49.2 XDV.1 XDR KP.2.2 JN.1.13.1 LE.1.3.1 KP.2.15 LN.1 KP.3.2.4 JN.1.3 JQ.2 BA.2.86.7 JN.1.55 XDQ.1.1 XDP.1 JN.1.5 JN.1.48.2 KP.2.12 LE.1.2 B.1.36.33 LE.2 BF.7.4.2 JN.2.4 JQ.2.1 KH.1 B.1.177.27 FK.1.2.2 FR.1.3 B.1.496 HU.2 BA.5.2.63 BA.2.67 JN.1.2 FL.24 JN.7	0.34030645 0.18265932 0.12621243 0.05161200 0.05161200 0.04889352 0.04681782 0.04226318 0.04059130 0.02385792 0.01172790 0.00877875 0.00591522 0.00308214 0.00297689 0.00293336 0.00162578 0.00118770 0.00113636 0.00078989 0.00046793 0.00046519 0.00035742 0.00033467 0.00031008 0.00026781 0.00022173 0.00021850 0.00021061 0.00018059 0.00017112 0.00015194 0.00013909 0.00012986 0.00012681 0.00012217 0.00011350 0.00011344 0.00010535 0.00009711 0.00008908 0.00008722 0.00007337 0.00007146 0.00006582 0.00006303 0.00004911 0.00004783 0.00004506 0.00004478 0.00004197 0.00003618 0.00000018 0.00000004 0.00000004 0.00000004 0.00000003 0.00000003 0.00000003 0.00000002 0.00000002 0.00000002 0.00000001 0.00000001 0.00000001 0.00000001 0.00000001 0.00000001	7.392395213399482	97.39491020967796
07_08_24_SBJUL04_R2__E0000000__X00__240712_2_SG_WW__001.tsv	[('BA.2.86* (BA.2.86.X)', np.float64(0.5174089566585848)), ('KP.2* (KP.2.X)', np.float64(0.20806654349382286)), ('LB.1* (LB.1.X)', np.float64(0.13198847296283878)), ('KP.3* (KP.3.X)', np.float64(0.1060389914267819)), ('JN.1.7* (JN.1.7.X)', np.float64(0.036278995914288195)), ('Other', np.float64(0.00013307935349753572)), ('A', np.float64(5.123768494273793e-05)), ('BA.2.75* [Omicron (BA.2.75.X)]', np.float64(3.3813371396597534e-05)), ('XBB* (XBB.X)', np.float64(2.6327567760613832e-08)), ('XBB.1.5* [Omicron (XBB.1.5.X)]', np.float64(1.5899106926942445e-08)), ('Delta', np.float64(1.1395095021507211e-08)), ('XBB.2.3* (XBB.2.3X)', np.float64(1.029132222822793e-08)), ('Omicron', np.float64(1.006740175727311e-08))]	KP.1.1.3 LB.1.7 KP.2.3 JN.1.16.3 KP.3 KP.2.3.3 KP.2.3.2 LF.3.1 KP.3.3 JN.1.7.4 KP.5 JN.1.48 KP.2.2 KP.2.10 LD.1 LP.1 KP.2.8 LB.1.4 KP.2.9 KR.1 LK.1 JN.1.4.8 KP.3.2.3 KP.3.1.4 JN.1.47 LB.1.6 LM.1 JQ.1 KP.2.15 KP.3.1.2 KP.3.2.4 JN.3.2.1 LE.1.3.1 JN.1.49.1 XDW JN.1.48.2 KP.2.16 JN.1.39.1 JN.1.50.1 A.2.5 JN.1.29.1 B.1.575.2 FR.1.3 LB.1.5 LB.1 KE.1 GK.1.10 AY.3.4 KH.1 DN.1.1.3	0.32939172 0.13107599 0.08128579 0.08008128 0.06701793 0.04811560 0.04811560 0.04276922 0.03820250 0.03588358 0.03085746 0.02241711 0.01371670 0.01240020 0.00633207 0.00362428 0.00359066 0.00065617 0.00058619 0.00039864 0.00039541 0.00030967 0.00026961 0.00025170 0.00022967 0.00022404 0.00019101 0.00016793 0.00016729 0.00016545 0.00013180 0.00012107 0.00011671 0.00010701 0.00009903 0.00009632 0.00008851 0.00008373 0.00006629 0.00005124 0.00004778 0.00003405 0.00003381 0.00003222 0.00000005 0.00000003 0.00000002 0.00000001 0.00000001 0.00000001	8.55467446191236	97.58887068187138
07_08_24_PLJUN30_R1__E0000000__X00__240712_2_SG_WW__001.tsv	[('LB.1* (LB.1.X)', np.float64(0.3790155255688842)), ('BA.2.86* (BA.2.86.X)', np.float64(0.2444954193278264)), ('KP.3.1.1* (KP.3.1.1.X)', np.float64(0.19520197645565898)), ('KP.3* (KP.3.X)', np.float64(0.1804889841422566)), ('KP.2* (KP.2.X)', np.float64(0.0007959827293328222)), ('Other', np.float64(1.5621797820516207e-05)), ('Omicron', np.float64(4.128647391015322e-06)), ('XBB* (XBB.X)', np.float64(3.1938162454918045e-06)), ('BA.2.75* [Omicron (BA.2.75.X)]', np.float64(1.091178906078739e-06)), ('XBB.1.5* [Omicron (XBB.1.5.X)]', np.float64(9.471214466296024e-07)), ('Delta', np.float64(9.223354583419336e-07)), ('CH.1.1* [Omicron (CH.1.1.X)]', np.float64(5.718267002227584e-07)), ('EG.5* [Omicron (EG.5.X)]', np.float64(5.358571485301126e-07)), ('A', np.float64(4.9919241042717e-07)), ('XBB.2.3* (XBB.2.3X)', np.float64(3.806866774693085e-07)), ('XBB.1.9.1* [Omicron (XBB.1.9.1.X)]', np.float64(3.551397874184845e-07)), ('XBB.1.16* [Omicron (XBB.1.16.X)]', np.float64(2.574634490322595e-07)), ('Gamma', np.float64(1.3452713291176646e-07)), ('XBB.1.9.2* [Omicron (XBB.1.9.2.X)]', np.float64(9.984737208486191e-08)), ('Iota', np.float64(3.4527093593308624e-08)), ('Alpha', np.float64(2.7739520577698954e-08)), ('Mu', np.float64(2.1106924747180098e-08)), ('JN.1.7* (JN.1.7.X)', np.float64(1.0998128484626274e-08))]	LB.1.1 KP.3.1.1 KP.3 KP.1.1.3 JN.1.11 JN.1.11.1-like KP.3.2.3-like KP.3.3 KP.2.8 LM.1 KP.4.1.3 KP.1.1.1 JN.1.48.2 JN.1.4.7-like LE.1.2 LF.3 KP.2.9 JN.3.2.1 KP.2.16 B.1.177.34 XBB.1.19.2 XDQ.1.1 FR.1.3 B.1.291 B.1.36.33 BF.11.3 BQ.1.1.42 HK.13.2.1 LL.1 GN.3 BA.2.68 CH.1.1.26 A.17 KV.2 BA.1.1.3 AY.3.4 B.1.505 GK.1.9 GE.1.6 KP.2.12 HW.1.3 XDK.1.2 FD.5.1 KP.1.1.2 P.1.17 BT.2 XBB.1.20 XBW BF.36 LE.1.3.1 HK.16 CN.2 AY.73 KP.1.1.4 B.1.593 BA.4.6.5 DN.1.1.2 KP.2.3-like BA.2.20 KP.4.2.2 KR.1 XAW XD A.23 B.1.640.2 B.1.214.4 GK.1.10 AY.3.1 BG.2 B.1.629 GJ.1.2.3 JN.1.2.1 HN.4 XAP GK.1.1.1 BF.11.4 DP.1 KP.4.1 B.1.258.18 CP.7 KP.2.1 JN.1.23 CH.1.1.14 HR.1 BA.5.2.14 AY.4.15 EZ.1 XDY CQ.1.1 KP.3.2.2 XBB.1.16.8 AY.92 XBJ.1.1 BU.2 LF.1.1 BA.2.76.2 KV.1 JN.5.1 EW.3 B.1.348 HN.3.1 JN.1.4.2 GY.4 AA.4 LE.2 DY.3 KH.1 DV.6.1 BZ.1 KL.1.1 BA.2.82 XDQ BA.2.9.1 HN.4.1 EV.1 B.1.637.1 JC.5.1 AY.46.6.1 KP.2.15 B.1.9.4 JN.1.29.1 B.1.526 JN.1.3 XDP.3 XBB.1.9.6 KP.2.4 B.1.160.9 BE.3 AY.11 CM.8.1.2 BN.1.3.11 KR.1.2 B.6.2 AY.17 DV.7.1.3 B.1.316 FU.4 JV.2 JQ.1 BA.4.1.8 KP.2.10 LF.1 EP.1.1.1 XBC.1.1.2 KZ.1-like AY.3.3 JH.2 XBJ.2 GJ.1.2.8 BA.5.10-like FL.4.5 B.1.258.22 BE.12 B.1.641 AY.121.1 A.19 LP.3 AY.78 GL.2 GA.10.1 FK.1.3.1 KP.2.6 Q.7 GJ.1.2.4 BA.1.16.1 BP.1 XCS BA.2.12.2 B.1.544 JQ.2.1.1 B.1.369.1 JN.11.1 GA.4.1.3 JN.1.49-like B.1.411 XBB.1.16.10 B.53 B.1.591 AY.112.3 B.1.488 GW.1.1 CR.1.1 EG.4.1 JN.1.19 BS.1.2 DC.1 FL.4.10 BF.21 A B.1.616 B.1.539 AY.36.1 LP.2 AY.31 XBB.1.5.50 B.1.177.42 KE.1 AY.24.1 XBB.1.5.74 JB.1.1 GW.5.3 KE.2 DV.7.1.6 EE.1 KP.4.2.1 B.1.363 JN.1.15.1-like XCP AY.87 JN.1.48.1 AB.1 BW.1.1 B.1.563 P.1.17.1 B.1.568 BA.2.12 JQ.2.1 BB.2 CM.12 KD.3 BA.5.1.38 EF.1.3 CK.1.5 KP.3.1.2 XDP.1 GN.1.3 B.1.36.39 HN.6 BA.5.2.12 AY.2 B.1.22.1 JE.1.1 B.1.598 CD.2 FL.32.1 FL.10.2 XBF.8.1 BA.2.86.3 CH.1.1.16 LF.1.1.1 XAL KP.4.1.1 EG.6.1 GL.1 JF.3 XCJ B.1.619.1 LP.1 B.1.258.16 KE.3 DN.1.1.3 BF.5.2 XBB.1.16.27 AY.34.1.1 A.3 JN.1.43.1 EG.7 XDQ.2 HE.1 BA.2.87.1 JN.1.31 XBC.2.1 XDP.2 FU.2.1 GW.5.2 B.1.622 BF.7.14.5 AY.9.2.2 JM.1 B.4.7 AY.33.1 FL.4.2 KP.2.2 AY.99.2 A.2.2 S.1 XBB.1.16.16 LF.3.1 A.2.5.3 B.1.438.4 HN.4.1.1 JL.1 AY.127.2 DE.2 FQ.1 DF.1.1 EG.10.1 BA.5.2.51 GJ.1.2.5 CK.1.1.1 B.1.160.21 B.1.516 JN.1.39.3 BF.5.4 XCW BF.7.5.1 GA.8.1 KP.2.13 AY.91.1 XDQ.3 GK.1.6.1 AY.5.2 FL.14 BQ.1.1.40 BQ.1.1.23 KP.4.1.2 BW.1.1.2 B.1.160.16 EG.6.1.1 BA.4.1.3 C.36.3.1 BQ.1.1.12 GA.4.2 AY.5.3 KP.2.11 AU.3 FK.1.2.2 JG.3.1 P.1.2 AY.127.3 XBB.1.16.32 C.36.2 XL FL.18.1 B.1.639 BE.1.4.2 DJ.1.2 XAM B.1.389 KR.1.1 B.1.632 FL.5.1 LE.1.1 KC.1 XBB.2.3.21 DJ.1.1.1 BQ.1.1.57 BQ.1.1.34 BF.5.3 JN.7 B.1.588.1 FL.4.11 XBB.1.16.15 AY.5.4 A.2.5-like JN.1.4.5 CP.1.1 EG.5.1.5 C.36.1 JD.1.2.1 B.1.575.2 FE.1.1.1 AY.120.2.1 AY.98.1.1 BW.1.1.1 JN.1.34 EG.4.4 JN.1.7.6 GK.1.2.1 A.5 HK.25 KC.1.1 EH.1 BQ.1.1.30 GN.1.4 AY.39.1.4 HN.4.2 XBZ GK.1.4 BA.5.2.39 AY.40 GQ.1.1 XDF GS.8 BA.5.1.32 BG.6 XBB.1.16.14 A.16 JP.1.1	0.37901553 0.19520198 0.16597755 0.16294888 0.04241584 0.03695716 0.00812379 0.00638758 0.00058381 0.00056136 0.00044313 0.00028458 0.00023356 0.00022242 0.00020557 0.00011552 0.00011463 0.00010536 0.00009709 0.00000913 0.00000279 0.00000249 0.00000103 0.00000089 0.00000083 0.00000074 0.00000051 0.00000038 0.00000037 0.00000034 0.00000034 0.00000031 0.00000031 0.00000027 0.00000026 0.00000019 0.00000019 0.00000018 0.00000017 0.00000017 0.00000017 0.00000016 0.00000012 0.00000011 0.00000010 0.00000010 0.00000010 0.00000009 0.00000009 0.00000009 0.00000008 0.00000008 0.00000007 0.00000007 0.00000007 0.00000007 0.00000006 0.00000006 0.00000006 0.00000006 0.00000006 0.00000006 0.00000006 0.00000006 0.00000006 0.00000006 0.00000006 0.00000006 0.00000006 0.00000005 0.00000005 0.00000005 0.00000005 0.00000005 0.00000005 0.00000005 0.00000005 0.00000005 0.00000005 0.00000005 0.00000005 0.00000005 0.00000005 0.00000005 0.00000004 0.00000004 0.00000004 0.00000004 0.00000004 0.00000004 0.00000004 0.00000004 0.00000004 0.00000004 0.00000004 0.00000004 0.00000004 0.00000004 0.00000004 0.00000004 0.00000004 0.00000004 0.00000004 0.00000004 0.00000004 0.00000004 0.00000004 0.00000004 0.00000004 0.00000004 0.00000004 0.00000004 0.00000004 0.00000004 0.00000004 0.00000004 0.00000003 0.00000003 0.00000003 0.00000003 0.00000003 0.00000003 0.00000003 0.00000003 0.00000003 0.00000003 0.00000003 0.00000003 0.00000003 0.00000003 0.00000003 0.00000003 0.00000003 0.00000003 0.00000003 0.00000003 0.00000003 0.00000003 0.00000003 0.00000003 0.00000003 0.00000003 0.00000003 0.00000003 0.00000003 0.00000003 0.00000003 0.00000003 0.00000003 0.00000003 0.00000003 0.00000003 0.00000003 0.00000003 0.00000003 0.00000003 0.00000003 0.00000003 0.00000003 0.00000003 0.00000003 0.00000003 0.00000003 0.00000003 0.00000003 0.00000003 0.00000003 0.00000003 0.00000003 0.00000003 0.00000003 0.00000003 0.00000003 0.00000003 0.00000003 0.00000003 0.00000003 0.00000003 0.00000003 0.00000003 0.00000003 0.00000002 0.00000002 0.00000002 0.00000002 0.00000002 0.00000002 0.00000002 0.00000002 0.00000002 0.00000002 0.00000002 0.00000002 0.00000002 0.00000002 0.00000002 0.00000002 0.00000002 0.00000002 0.00000002 0.00000002 0.00000002 0.00000002 0.00000002 0.00000002 0.00000002 0.00000002 0.00000002 0.00000002 0.00000002 0.00000002 0.00000002 0.00000002 0.00000002 0.00000002 0.00000002 0.00000002 0.00000002 0.00000002 0.00000002 0.00000002 0.00000002 0.00000002 0.00000002 0.00000002 0.00000002 0.00000002 0.00000002 0.00000002 0.00000002 0.00000002 0.00000002 0.00000002 0.00000002 0.00000002 0.00000002 0.00000002 0.00000002 0.00000002 0.00000002 0.00000002 0.00000002 0.00000002 0.00000002 0.00000002 0.00000002 0.00000002 0.00000002 0.00000002 0.00000002 0.00000002 0.00000002 0.00000002 0.00000002 0.00000002 0.00000002 0.00000002 0.00000002 0.00000002 0.00000002 0.00000002 0.00000002 0.00000002 0.00000002 0.00000002 0.00000002 0.00000002 0.00000002 0.00000002 0.00000002 0.00000002 0.00000002 0.00000002 0.00000002 0.00000002 0.00000002 0.00000002 0.00000002 0.00000002 0.00000002 0.00000001 0.00000001 0.00000001 0.00000001 0.00000001 0.00000001 0.00000001 0.00000001 0.00000001 0.00000001 0.00000001 0.00000001 0.00000001 0.00000001 0.00000001 0.00000001 0.00000001 0.00000001 0.00000001 0.00000001 0.00000001 0.00000001 0.00000001 0.00000001 0.00000001 0.00000001 0.00000001 0.00000001 0.00000001 0.00000001 0.00000001 0.00000001 0.00000001 0.00000001 0.00000001 0.00000001 0.00000001 0.00000001 0.00000001 0.00000001 0.00000001 0.00000001 0.00000001 0.00000001 0.00000001 0.00000001 0.00000001 0.00000001 0.00000001 0.00000001 0.00000001 0.00000001 0.00000001 0.00000001 0.00000001 0.00000001 0.00000001 0.00000001 0.00000001 0.00000001 0.00000001 0.00000001 0.00000001 0.00000001 0.00000001 0.00000001 0.00000001 0.00000001 0.00000001 0.00000001 0.00000001 0.00000001 0.00000001 0.00000001 0.00000001 0.00000001 0.00000001 0.00000001 0.00000001 0.00000001 0.00000001 0.00000001 0.00000001 0.00000001 0.00000001 0.00000001 0.00000001 0.00000001 0.00000001 0.00000001 0.00000001 0.00000001 0.00000001 0.00000001 0.00000001 0.00000001 0.00000001 0.00000001 0.00000001	5.509119654348649	92.12119185366016
