	summarized	lineages	abundances	resid	coverage
07_15_24_ENCJUL09_R2__E0000000__X00__240718_SG_WW__001.tsv	[('BA.2.86* (BA.2.86.X)', np.float64(0.5363374235437336)), ('KP.2* (KP.2.X)', np.float64(0.25917988527026853)), ('KP.3* (KP.3.X)', np.float64(0.16862749614545608)), ('LB.1* (LB.1.X)', np.float64(0.03550889519070074)), ('KP.3.1.1* (KP.3.1.1.X)', np.float64(0.00021161799605604628)), ('Other', np.float64(0.00013467965155177438))]	KP.1.1 KP.2.3 KP.3.3 KP.2.2 KP.1.1.5 KP.1.1.1 LB.1.1 KP.2.3-like KP.3.1-like LB.1.4 JN.1.4.4 LR.2 KP.3.1.4 KR.1.1 KP.2.15 KP.2.8 LM.1 LF.3 KP.3.1.1 JN.1.5 KP.3.2.3-like LE.1.1 XDP.3 KP.2.16 KP.3.1.2 JN.3.2.1	0.46437280 0.19085920 0.15472400 0.04287760 0.03094780 0.02959040 0.02484800 0.02382980 0.01177552 0.01066090 0.00651284 0.00254777 0.00189753 0.00142045 0.00111607 0.00042983 0.00037489 0.00021176 0.00021162 0.00019212 0.00018877 0.00016650 0.00013468 0.00006739 0.00004167 0.00000009	6.96157341272491	95.31485135270708
07_15_24_ENCJUL10_R1__E0000000__X00__240718_SG_WW__001.tsv	[('KP.2* (KP.2.X)', np.float64(0.508148641201329)), ('KP.3.1.1* (KP.3.1.1.X)', np.float64(0.38095198911234684)), ('BA.2.86* (BA.2.86.X)', np.float64(0.0813061476845908)), ('LB.1* (LB.1.X)', np.float64(0.029112099999804266)), ('JN.1.7* (JN.1.7.X)', np.float64(0.00044915972650609126)), ('Other', np.float64(3.272221610122387e-05)), ('XBB.1.5* [Omicron (XBB.1.5.X)]', np.float64(2.3881723777092037e-07)), ('Omicron', np.float64(5.4096100496342536e-08)), ('CH.1.1* [Omicron (CH.1.1.X)]', np.float64(1.6630646980693103e-08)), ('XBB.1.9.1* [Omicron (XBB.1.9.1.X)]', np.float64(1.0873153725457893e-08))]	KP.2.15 KP.3.1.1 KP.2.3 JN.1.4-like KP.2.3-like LB.1.3 JN.1.26 KP.1.1.5 JN.1-like(2) JN.1.6-like KP.2.2 KP.1.1.1 JN.1.2 KP.2.6 BA.2.86-like JN.1.14 JN.1.7.4 JN.1.3 JN.1.49-like LE.1.2 JN.1.48.1 JN.1.19 XDP.3 B.1.438.4 GK.1.9 B.1.36.33 B.1.177.34 KS.1 KP.1-like EE.1 KR.1 LL.1 BA.2.3.15 LV.2 JN.1.2.1 JV.2 XDP.2 LP.1 XDP.1 XCZ KV.1 FL.18.1.1 BF.7.5.1 KR.1.1	0.38410390 0.38095199 0.08982240 0.04898826 0.03175060 0.02911210 0.01782886 0.00679428 0.00232810 0.00205760 0.00185299 0.00078401 0.00075241 0.00061876 0.00057693 0.00045434 0.00044916 0.00025054 0.00018038 0.00012841 0.00010451 0.00007736 0.00003165 0.00000086 0.00000024 0.00000011 0.00000006 0.00000003 0.00000003 0.00000002 0.00000002 0.00000002 0.00000002 0.00000002 0.00000002 0.00000002 0.00000001 0.00000001 0.00000001 0.00000001 0.00000001 0.00000001 0.00000001 0.00000001	4.528811245497826	90.59291709861887
07_15_24_PLJUL10_R1__E0000000__X00__240718_SG_WW__001.tsv	[('LB.1* (LB.1.X)', np.float64(0.4351539231890771)), ('KP.3.1.1* (KP.3.1.1.X)', np.float64(0.1688659452207363)), ('KP.2* (KP.2.X)', np.float64(0.15735951993666702)), ('BA.2.86* (BA.2.86.X)', np.float64(0.12648947149888456)), ('KP.3* (KP.3.X)', np.float64(0.11166502484839062)), ('JN.1.7* (JN.1.7.X)', np.float64(0.00042494678207712945)), ('Other', np.float64(5.106584083331e-05)), ('Omicron', np.float64(3.2773793960901154e-06)), ('XBB* (XBB.X)', np.float64(1.2704738138352913e-06)), ('Delta', np.float64(1.177250404215289e-06)), ('XBB.1.5* [Omicron (XBB.1.5.X)]', np.float64(7.378305188904754e-07)), ('BA.2.75* [Omicron (BA.2.75.X)]', np.float64(5.384603510826727e-07)), ('CH.1.1* [Omicron (CH.1.1.X)]', np.float64(4.1863928918947736e-07)), ('EG.5* [Omicron (EG.5.X)]', np.float64(3.77460904826614e-07)), ('XBB.1.9.1* [Omicron (XBB.1.9.1.X)]', np.float64(3.0365408639642576e-07)), ('XBB.1.16* [Omicron (XBB.1.16.X)]', np.float64(2.681747254387596e-07)), ('A', np.float64(2.5893733787799824e-07)), ('XBB.2.3* (XBB.2.3X)', np.float64(1.5407070191057943e-07)), ('XBB.1.9.2* [Omicron (XBB.1.9.2.X)]', np.float64(7.774803701650363e-08)), ('Gamma', np.float64(3.6476865567449834e-08)), ('Beta', np.float64(2.5983083436606387e-08)), ('Mu', np.float64(1.5317944856594894e-08)), ('Iota', np.float64(1.271213437841641e-08))]	LB.1.1 KP.3.1.1 KP.2.3-like LB.1.3 JN.1.11.1-like KP.3.3 KP.3.2.3-like JN.1.26 JN.1.4-like KP.5 JN.1.4.3-like JN.1.48 LE.1.3.1 JN.1.7.4 JN.1.49-like JN.3.2.1 KP.2.16 BA.2.86.3 LL.1 XDQ BA.2.86.7 B.1.177.34 BQ.1.1.59 KV.1 AY.3.4 B.1.516 BA.5.1.32 XBB.1.19.2 JN.1.2 CH.1.1.14 JZ.1 HK.23 JN.1.8.2 JN.1.8.1 FR.1.2 JN.1.2.1 A.17 JN.1.19 XBB.1.16.8 LE.2 XBB.9 BG.2 KP.2.12 KP.4.2.2 JC.3 XCM FL.37 LB.1.7 KR.1-like GB.1 HE.1 FL.24 FR.1.4 JQ.1 B.1.36.16 HW.1.3 AY.73 HH.8 AY.4.2.1 XBB.1.48 BA.1.15.1 LP.1 B.53 JN.1.57 BA.2.76.2 JN.1.8.4 JV.2 EG.6.1.2 JF.4 JN.1.4.1 B.1.438.4 XDQ.2 BA.2.62 JD.1.1.4 B.1.466.1 JD.1.2.1 XCZ BA.2.82 B.1.466 XBF.7.1 XAW JQ.2.1 XBB.2.2 BF.5.5 JD.1.2.2 XDQ.3 P.1.2 GW.1.1 BQ.1.1.54 GK.1.5 B.1.591 KP.2.3.1 KP.2.6 JN.1.31 B.1.160.23 GM.3 XDQ.1 KP.3.1-like FR.1.3 AY.31 GK.1.6 BA.1.24 GJ.1.2.3 DB.2 B.1.36.19 BZ.1 JN.1.48.1 LD.1 KP.2.3 LE.1.2 XDG BF.7.4.2 KE.3 BL.5 B.1.1.324 JN.1.48.2 B.1.334 HR.1 XBB.1.14.1 B.1.36.33 XDK.4.1 B.1.1.39 KY.1 HK.23.1 BF.7.5.1 FL.4.5 BF.22 B.1.351.5 GK.1.10 KP.2.1 EE.1 EP.2 FU.4 GA.4.1.3 AY.11 A.2.5-like B.1.160.20 EG.5.2.2 B.1.1.435 EP.1.1.1 KV.2 JN.1.52 DV.7.1.2 JN.1.39.3 BF.36 BA.4.1.11 GA.6.1 KP.2.10 R.1 FR.1 LM.1 KP.2.4 BS.1.2 HK.3.3 BF.7.14.2 HK.25 KM.1 GW.5.3 BA.2.10.4 LG.1 GY.4 HK.23.1.1 HK.13.2.1 HH.8.1 B.1.258.7 XDP.3 BM.1.1.2 B.1.170 BA.4.6.5 HP.1.1 KP.4.2.1 JN.1.5 CH.1.1.9 KP.3.1.5 CA.3 BA.5.2.12 FR.1.5 B.1.630 EG.6.1 AY.24.1 FL.28 AY.40 CM.8.1.5 DY.2 XBJ.1 CP.8 FL.18.1 JN.1.4-like(1) C.2.1 JN.1.4.6 FL.1.2 JN.1.49.2 GU.1 JN.1.7-like B.6.8 XBB.1.20 BN.1.3.11 JB.1.1 XBB.6.1 JN.1-like(2) JN.1.16.3 B.1.563 B.1.532 FL.32.1 BA.1.1.5 B.1.221.3 XAQ KP.2.15 KP.3 BA.5.2.51 XBB.1.34.1 XDK.4 BA.1.10 BE.8 CN.1 B.1.177.87 XBB.3.3 BE.1.4.3 XB BF.7.21 FR.1.1 XBC.1.6.5 AY.70 BP.1 BA.2.53 BB.2 JN.1.27 BE.12 KP.2.9 FD.5.1 HK.29 FK.1.2.2 XDZ JN.1.7.7 B.1.9.3 JV.1 B.1.160.15 XBC.1.1.1 LR.1 XCP XU BR.2.1 BA.2.9.1 A.2.5.3 XBR AY.17 KP.2.13 XAY.1.2 B.1.619.1 B.1.36.18 KP.2.11 BR.4 DC.1 HR.1.1 XBB.2.10 KP.2.2 JQ.2 B.1.243.2 B.1.526 JF.3 GK.1.2.1 BA.5.2.14 KR.1.1 KP.3.1.4 XDN LB.1.2-like BA.5.2.25 BA.5.12 XCS BA.2.75.10 A.21 XAY.1.1.2 JQ.2.1.1 XDY AY.25.3 A.28 FL.24.1 JN.1.7.5 B.1.36.17 KP.4-like BF.42 GA.2.1.1 B.1.160.9 B.1.499.1 JN.1.50-like XBB.3.2 B.1.36.26 JN.5.1 XCG BF.5.3 XBB.1.16.16 XBB.3.1 GK.1.1.1 XDT BF.41.1 BA.2.9.7 B.1.616 EG.6.1.1 BA.5.2.39 BF.11.1 AQ.2 FK.1.3.1 B.1.36.31 B.1.641 JN.1.14 XBF.9 KN.1.1 DB.3 B.1.622 EV.1 HN.6 FL.1.8 B.1.640	0.31089388 0.16886595 0.15712396 0.12425994 0.09785677 0.08816630 0.02349865 0.01422558 0.00842241 0.00162958 0.00138485 0.00127059 0.00059704 0.00042490 0.00038505 0.00034348 0.00023520 0.00022885 0.00010937 0.00004103 0.00003248 0.00000767 0.00000125 0.00000093 0.00000090 0.00000088 0.00000079 0.00000056 0.00000052 0.00000029 0.00000027 0.00000023 0.00000020 0.00000020 0.00000020 0.00000020 0.00000020 0.00000017 0.00000015 0.00000015 0.00000013 0.00000012 0.00000012 0.00000012 0.00000012 0.00000009 0.00000009 0.00000008 0.00000008 0.00000008 0.00000008 0.00000008 0.00000007 0.00000007 0.00000007 0.00000007 0.00000007 0.00000007 0.00000007 0.00000007 0.00000007 0.00000007 0.00000006 0.00000006 0.00000006 0.00000005 0.00000005 0.00000005 0.00000005 0.00000005 0.00000005 0.00000005 0.00000004 0.00000004 0.00000004 0.00000004 0.00000004 0.00000004 0.00000004 0.00000004 0.00000004 0.00000004 0.00000004 0.00000004 0.00000004 0.00000004 0.00000004 0.00000004 0.00000004 0.00000004 0.00000004 0.00000004 0.00000004 0.00000004 0.00000003 0.00000003 0.00000003 0.00000003 0.00000003 0.00000003 0.00000003 0.00000003 0.00000003 0.00000003 0.00000003 0.00000003 0.00000003 0.00000003 0.00000003 0.00000003 0.00000003 0.00000003 0.00000003 0.00000003 0.00000003 0.00000003 0.00000003 0.00000003 0.00000003 0.00000003 0.00000003 0.00000003 0.00000003 0.00000003 0.00000003 0.00000003 0.00000003 0.00000003 0.00000003 0.00000003 0.00000003 0.00000003 0.00000003 0.00000002 0.00000002 0.00000002 0.00000002 0.00000002 0.00000002 0.00000002 0.00000002 0.00000002 0.00000002 0.00000002 0.00000002 0.00000002 0.00000002 0.00000002 0.00000002 0.00000002 0.00000002 0.00000002 0.00000002 0.00000002 0.00000002 0.00000002 0.00000002 0.00000002 0.00000002 0.00000002 0.00000002 0.00000002 0.00000002 0.00000002 0.00000002 0.00000002 0.00000002 0.00000002 0.00000002 0.00000002 0.00000002 0.00000002 0.00000002 0.00000002 0.00000002 0.00000002 0.00000002 0.00000002 0.00000002 0.00000002 0.00000002 0.00000002 0.00000002 0.00000002 0.00000002 0.00000002 0.00000002 0.00000002 0.00000002 0.00000002 0.00000002 0.00000002 0.00000002 0.00000002 0.00000002 0.00000002 0.00000002 0.00000002 0.00000002 0.00000002 0.00000002 0.00000002 0.00000002 0.00000002 0.00000002 0.00000002 0.00000002 0.00000002 0.00000002 0.00000002 0.00000002 0.00000002 0.00000002 0.00000002 0.00000002 0.00000002 0.00000002 0.00000002 0.00000002 0.00000002 0.00000002 0.00000002 0.00000002 0.00000002 0.00000002 0.00000002 0.00000002 0.00000002 0.00000001 0.00000001 0.00000001 0.00000001 0.00000001 0.00000001 0.00000001 0.00000001 0.00000001 0.00000001 0.00000001 0.00000001 0.00000001 0.00000001 0.00000001 0.00000001 0.00000001 0.00000001 0.00000001 0.00000001 0.00000001 0.00000001 0.00000001 0.00000001 0.00000001 0.00000001 0.00000001 0.00000001 0.00000001 0.00000001 0.00000001 0.00000001 0.00000001 0.00000001 0.00000001 0.00000001 0.00000001 0.00000001 0.00000001 0.00000001 0.00000001 0.00000001 0.00000001 0.00000001 0.00000001 0.00000001 0.00000001 0.00000001 0.00000001 0.00000001 0.00000001 0.00000001 0.00000001 0.00000001 0.00000001 0.00000001 0.00000001 0.00000001 0.00000001 0.00000001 0.00000001 0.00000001 0.00000001 0.00000001 0.00000001 0.00000001 0.00000001 0.00000001 0.00000001 0.00000001 0.00000001 0.00000001 0.00000001 0.00000001 0.00000001 0.00000001 0.00000001 0.00000001 0.00000001 0.00000001 0.00000001 0.00000001 0.00000001 0.00000001 0.00000001	3.8224474438575182	91.31859679630806
07_15_24_SBJUL11_R1__E0000000__X00__240718_SG_WW__001.tsv	[('KP.2* (KP.2.X)', np.float64(0.5019798061206449)), ('BA.2.86* (BA.2.86.X)', np.float64(0.2521031026246133)), ('KP.3.1.1* (KP.3.1.1.X)', np.float64(0.1921700003109017)), ('JN.1.7* (JN.1.7.X)', np.float64(0.03715774826722572)), ('KP.3* (KP.3.X)', np.float64(0.011363600254860398)), ('LB.1* (LB.1.X)', np.float64(0.005025128674707802)), ('Other', np.float64(0.00020060131395607117)), ('XBB.1.16* [Omicron (XBB.1.16.X)]', np.float64(2.1883787982651503e-08)), ('Delta', np.float64(1.2015719086201211e-08))]	KP.2-like KP.3.1.1 KP.1.1 KP.2.3-like KP.5 KP.1.2 JN.1.7.3 KP.3.3 KP.1.1.3 LB.1.4 JN.1.4.8 JN.1.2.1 KP.1.1.4 LE.1 JN.1.27 KQ.1 JN.1.49.1 XEB KP.2.9 KP.2.8 JN.1.26 JN.1.3 B.1.36.33 GY.8 AY.3.4	0.42361275 0.19217000 0.12916899 0.07811930 0.06330744 0.04722161 0.03715775 0.01136360 0.00916325 0.00502513 0.00062696 0.00060569 0.00060015 0.00047687 0.00040883 0.00030396 0.00020483 0.00020058 0.00017025 0.00007751 0.00001445 0.00000008 0.00000003 0.00000002 0.00000001	4.99807591119183	93.15787713607331
07_15_24_PLJUL09_R1__E0000000__X00__240718_SG_WW__001.tsv	[('KP.3* (KP.3.X)', np.float64(0.2659809982821753)), ('BA.2.86* (BA.2.86.X)', np.float64(0.24559362420865813)), ('LB.1* (LB.1.X)', np.float64(0.23951799683232056)), ('KP.2* (KP.2.X)', np.float64(0.18116415679630254)), ('KP.3.1.1* (KP.3.1.1.X)', np.float64(0.06735199947876876)), ('JN.1.7* (JN.1.7.X)', np.float64(0.0003911830830044812)), ('Other', np.float64(4.3454653495598686e-08)), ('Omicron', np.float64(1.3683254315723953e-08))]	KP.2.3-like JN.1.11.1-like LB.1.3 KP.3 KP.3.3 LB.1.1 KP.3.1.1 JN.1.13 KP.3.2 KP.1-like JN.1.58.1 KP.3.1-like KP.5 KP.1.2 KP.2.15 JN.1.26 KP.2.2 JN.1.39.3 KP.1.1.4 LL.1 JN.1.7.4 LM.1 KR.1.1 KP.2.9 JN.3.2.1 B.1.334 JN.1.7.6 B.1.611 BA.5.2.35 B.1.499	0.17758400 0.14635052 0.13709700 0.12011870 0.10581700 0.10242100 0.06735200 0.04627680 0.02895110 0.01964408 0.01913880 0.01109420 0.00547981 0.00441383 0.00267237 0.00176824 0.00076512 0.00071633 0.00067159 0.00053078 0.00039117 0.00031296 0.00019942 0.00014267 0.00009046 0.00000002 0.00000002 0.00000001 0.00000001 0.00000001	3.945228263082485	92.21817208975688
07_15_24_PLJUL08_R2__E0000000__X00__240718_SG_WW__001.tsv	[('BA.2.86* (BA.2.86.X)', np.float64(0.35609383140285195)), ('KP.3.1.1* (KP.3.1.1.X)', np.float64(0.22546999961849767)), ('KP.2* (KP.2.X)', np.float64(0.19465360393642303)), ('KP.3* (KP.3.X)', np.float64(0.16436099943044127)), ('JN.1.18* (JN.1.18.X)', np.float64(0.05907666001218486)), ('Other', np.float64(0.0003449148885461364))]	KP.3.1.1 LF.3 KP.1.1.3 KP.1-like KP.2.3.2 KP.2.3.3 KP.3.3 KP.3 JN.1.18.5 JN.1.49.2 KP.2.3 KP.1.1.1 KP.3.1-like JN.1.4-like LL.1 KP.2.4 JN.1.11.1-like KP.2.8 KP.2.15 JN.1.8.2 KP.2.2 KP.3.2.3 JN.1.55 JN.1.27 KR.1.1 LE.1.2 JN.1.48.2 JN.5 JN.1.8.3 JN.1.3 LQ.3 XDK.1 XDQ.1.1 JN.3.2.1 KP.2.9 XDV JN.5.1 KP.3.2.4 B.1.177.34	0.22547000 0.07864689 0.07739100 0.07414480 0.06961800 0.06961800 0.06761590 0.06209864 0.05894454 0.04878600 0.04281100 0.03516520 0.03434500 0.01970198 0.01233500 0.01060348 0.00775439 0.00089410 0.00062099 0.00053135 0.00037538 0.00024510 0.00023910 0.00022562 0.00019110 0.00018292 0.00017705 0.00017593 0.00013644 0.00013254 0.00013212 0.00012711 0.00012319 0.00011478 0.00011266 0.00009457 0.00006175 0.00005637 0.00000004	6.72621315557539	95.5088118249005
07_15_24_PLJUL07_R1__E0000000__X00__240718_SG_WW__001.tsv	[('BA.2.86* (BA.2.86.X)', np.float64(0.6621832522835979)), ('KP.3* (KP.3.X)', np.float64(0.13880709803097643)), ('KP.2* (KP.2.X)', np.float64(0.11275628776408661)), ('LB.1* (LB.1.X)', np.float64(0.08458576797341058)), ('KP.3.1.1* (KP.3.1.1.X)', np.float64(0.001435910666483346)), ('Other', np.float64(0.00023174605744354492)), ('Omicron', np.float64(1.3710260246218715e-08))]	KP.1-like KP.2.3-like JN.1.11.1-like KP.3.3 KP.1.2 LB.1.1 KP.5 KP.3.2.3-like LB.1.3 JN.1.42-like LP.1 KP.3.1.4 KP.2.9 KP.3.1.1 KY.1 XDK.4 LE.1.2 JN.1.4.7-like LF.3 JN.1.55 JN.3.2.1 JN.1.4-like JN.1.4.3-like B.1.36.33 KP.2.2 B.1.177.39 B.1.328 EE.1	0.38037299 0.11009200 0.10131937 0.08904580 0.08547670 0.05444500 0.05279831 0.04481080 0.03014077 0.02276885 0.01729631 0.00495050 0.00266425 0.00143591 0.00125892 0.00023164 0.00021322 0.00017140 0.00015123 0.00015108 0.00013268 0.00003611 0.00003610 0.00000006 0.00000004 0.00000003 0.00000002 0.00000001	3.4203489360872665	91.92723138146674
07_15_24_SBJUL14_R2__E0000000__X00__240718_SG_WW__001.tsv	[('BA.2.86* (BA.2.86.X)', np.float64(0.5270758163285078)), ('KP.3* (KP.3.X)', np.float64(0.2842811865150561)), ('LB.1* (LB.1.X)', np.float64(0.11832107189115659)), ('KP.2* (KP.2.X)', np.float64(0.07011828249389647)), ('Other', np.float64(0.00010939151019698023)), ('JN.1.7* (JN.1.7.X)', np.float64(9.602235517747716e-05)), ('Omicron', np.float64(6.50844219184262e-07)), ('Delta', np.float64(3.0571780206263214e-07)), ('XBB.1.5* [Omicron (XBB.1.5.X)]', np.float64(2.5478153908057055e-07)), ('XBB* (XBB.X)', np.float64(1.6046429951558305e-07)), ('BA.2.75* [Omicron (BA.2.75.X)]', np.float64(1.376620463041601e-07)), ('XBB.1.16* [Omicron (XBB.1.16.X)]', np.float64(8.01572600050903e-08)), ('CH.1.1* [Omicron (CH.1.1.X)]', np.float64(6.990685113402447e-08)), ('EG.5* [Omicron (EG.5.X)]', np.float64(5.967119620931652e-08)), ('JN.1.18* (JN.1.18.X)', np.float64(4.896503157121727e-08)), ('XBB.1.9.1* [Omicron (XBB.1.9.1.X)]', np.float64(3.9447655945400706e-08)), ('Iota', np.float64(2.3869990883222034e-08)), ('XBB.1.9.2* [Omicron (XBB.1.9.2.X)]', np.float64(1.2936632661641265e-08)), ('XBB.2.3* (XBB.2.3X)', np.float64(1.160646552072805e-08))]	JN.1-like(2) KP.3.1-like JN.1.11.1-like LB.1.3 KP.2.3-like KP.1-like KP.1.1.3 KP.3.3 KP.3.2 KR.1.1 JN.1.1.6 KP.4.2.1 KP.2.10 KP.1.1.5 KP.3.2.2 JN.1.4-like LM.1 JN.1.26 KP.2.16 KP.3.2.3-like JN.1.49-like JN.1.3 XDP.3 JN.1.7.4 KP.5 JN.1.16.3 KP.1.2 JN.1.4-like(1) JN.1.48.2 KR.1.2 B.1.146 LL.1 AY.21 KM.1 EE.1 XDP B.1.177.34 BA.2.9.1 B.1.408 KP.2.2 XBB.1.19.2 B.1.280 B.1.36.19 KU.2 BL.5 XBB.1.16.16 B.1.334 B.1.448 B.53 LB.1.1 XDN AY.73 JN.1.43.1 HK.23 LQ.1 BE.9 BA.1.20 KP.4.2.2 BF.11.1 JN.3.2.1 BA.4.1.10 HK.16 BQ.1.6 FL.1.5 FK.1.4-like JN.1.15.1-like XBB.9 B.1.526 XDP.2 EP.2 BA.5.2.12 XBB.1.48 XDK.4.1 XAU BA.5.2.32 KP.2.12 XDP.1 JN.1.57 XCP LB.1.2-like BF.8 DV.1.1 JN.1.31 JN.1.52 B.1.488 LS.1 JN.1.47 B.1.328 B.1.539 JN.1.62 XBB.1.5.50 AY.127.2 B.1.516 B.1.177.87 BN.1.3.6 DY.2 JN.5.1 HW.1.3 XBJ.1.1 FK.1.1.1 EG.1 KP.2.15 XBG FL.15.2 KP.2.3.1 B.1.496 BF.7.5.1 XAW JN.1.2.1 FD.1.1 KG.1 KV.1 B.1.619.1 GJ.1.2.3 AY.78 GY.4 BA.2.46 XCV KP.3.1.4 BF.22 FR.1.5 KV.2 AA.8 FR.1.3 B.1.591	0.26633851 0.25943479 0.20126724 0.11832100 0.06913409 0.03244872 0.01736549 0.01303540 0.01105528 0.00304834 0.00234613 0.00170793 0.00076989 0.00075449 0.00056093 0.00049799 0.00044189 0.00027600 0.00021414 0.00019477 0.00011698 0.00010734 0.00010694 0.00009602 0.00007333 0.00007332 0.00007317 0.00006432 0.00006298 0.00001086 0.00000134 0.00000044 0.00000024 0.00000023 0.00000022 0.00000015 0.00000014 0.00000013 0.00000013 0.00000011 0.00000011 0.00000011 0.00000011 0.00000009 0.00000008 0.00000007 0.00000007 0.00000007 0.00000006 0.00000005 0.00000004 0.00000004 0.00000003 0.00000003 0.00000003 0.00000003 0.00000003 0.00000003 0.00000003 0.00000003 0.00000003 0.00000003 0.00000003 0.00000003 0.00000003 0.00000003 0.00000003 0.00000002 0.00000002 0.00000002 0.00000002 0.00000002 0.00000002 0.00000002 0.00000002 0.00000002 0.00000002 0.00000002 0.00000002 0.00000002 0.00000002 0.00000002 0.00000002 0.00000002 0.00000002 0.00000002 0.00000002 0.00000002 0.00000002 0.00000001 0.00000001 0.00000001 0.00000001 0.00000001 0.00000001 0.00000001 0.00000001 0.00000001 0.00000001 0.00000001 0.00000001 0.00000001 0.00000001 0.00000001 0.00000001 0.00000001 0.00000001 0.00000001 0.00000001 0.00000001 0.00000001 0.00000001 0.00000001 0.00000001 0.00000001 0.00000001 0.00000001 0.00000001 0.00000001 0.00000001 0.00000001 0.00000001 0.00000001 0.00000001 0.00000001	3.2521124115078135	90.70661806507708
