	summarized	lineages	abundances	resid	coverage
06_24_24_PLJUN17_R2__E0000000__X00__240627_2_SG_WW__001.tsv	[('KP.2* (KP.2.X)', np.float64(0.5135420018987551)), ('KP.3* (KP.3.X)', np.float64(0.20874770579277543)), ('BA.2.86* (BA.2.86.X)', np.float64(0.20793644428812985)), ('LB.1* (LB.1.X)', np.float64(0.06903728538526431)), ('Other', np.float64(0.0004323526825241296)), ('JN.1.7* (JN.1.7.X)', np.float64(0.00019688842811595403)), ('A', np.float64(7.010258129552701e-05)), ('XBB.2.3* (XBB.2.3X)', np.float64(1.958539456029222e-05)), ('Omicron', np.float64(1.2344258783642416e-05)), ('KP.3.1.1* (KP.3.1.1.X)', np.float64(5.293238197370944e-06))]	KP.2.3 KP.3.1 JN.1.11 LB.1.3 KP.3.2 KP.3.3 KP.5 JN.1.13 JN.1.16.3 KP.2.3.2 KP.2.3.3 JN.1.24.1 KP.1.1.1 KP.1.1.3 KP.2.2 JN.1.51.1 LB.1.4 JN.1.25.1 JN.1.8.1 KP.3.1.2 KP.1.1.4 KP.3.2.1 JN.2.5 KP.3.2.2 JN.1.47.1 LP.1 XDK.1.2 LM.1 KP.3.2.3 KP.2.15 JN.1.7.2 KP.2.3.1 JN.1.5 LE.1.2 LD.1 KS.1 KP.2.12 JN.1.29.1 JN.1.3 JN.1.48.2 LF.3 KP.2.16 JN.1.17 JN.1.49.1 JN.3.2.1 JN.2.4 KR.1.1 JN.1.38 JN.1.55 KP.2.9 KP.3.2.4 JQ.2 XDQ.1.1 KP.2.6 LF.3.1 B.1.626 A.28 A.2.5.2 JN.1.31 LE.1.3.1 B.1.177.34 XAW KH.1 JN.1.41 JN.2.2.1 BF.5.3 KP.3.1.1	0.46575950 0.09190100 0.08942555 0.06848480 0.06047912 0.05480300 0.03023284 0.02933192 0.02707334 0.02121890 0.02121890 0.00989523 0.00861462 0.00771491 0.00450324 0.00065531 0.00055249 0.00054896 0.00049706 0.00048540 0.00043607 0.00040883 0.00037963 0.00035208 0.00033931 0.00029200 0.00028508 0.00024072 0.00022482 0.00021605 0.00019689 0.00018919 0.00018235 0.00017662 0.00016816 0.00016408 0.00016140 0.00015571 0.00015384 0.00013192 0.00012630 0.00012481 0.00012435 0.00012426 0.00012072 0.00012059 0.00011447 0.00009627 0.00009599 0.00009536 0.00009344 0.00006427 0.00005603 0.00005463 0.00005374 0.00004420 0.00003657 0.00003353 0.00002916 0.00002736 0.00002724 0.00001980 0.00001959 0.00001634 0.00001247 0.00001234 0.00000529	7.753853410156374	97.33805972644885
06_24_24_SBJUN20_R2__E0000000__X00__240627_2_SG_WW__001.tsv	[('LB.1* (LB.1.X)', np.float64(0.45146955420219836)), ('BA.2.86* (BA.2.86.X)', np.float64(0.21632453449955966)), ('JN.1.7* (JN.1.7.X)', np.float64(0.18471299440075659)), ('KP.3* (KP.3.X)', np.float64(0.09178638265362789)), ('KP.2* (KP.2.X)', np.float64(0.055705850438610933)), ('Other', np.float64(2.0664743636661375e-06)), ('Omicron', np.float64(4.3060525898906223e-07)), ('XBB.1.5* [Omicron (XBB.1.5.X)]', np.float64(2.4549582918791456e-07)), ('Delta', np.float64(1.1073838578505449e-07)), ('XBB.1.16* [Omicron (XBB.1.16.X)]', np.float64(7.831034012831383e-08)), ('BA.2.75* [Omicron (BA.2.75.X)]', np.float64(5.662066646415017e-08)), ('EG.5* [Omicron (EG.5.X)]', np.float64(5.171329884689759e-08)), ('XBB* (XBB.X)', np.float64(2.959839680857278e-08)), ('XBB.1.9.1* [Omicron (XBB.1.9.1.X)]', np.float64(2.9085653040029803e-08)), ('CH.1.1* [Omicron (CH.1.1.X)]', np.float64(2.5186170545895456e-08)), ('Gamma', np.float64(1.4344770134034462e-08)), ('XBB.2.3* (XBB.2.3X)', np.float64(1.002058462996568e-08))]	LB.1.3 JN.1.57 JN.1.7.1 JN.1.7 JN.1.7.4 JN.1.7.3 KP.3.1.3 KP.3.1 JN.1.11.1 KP.2 KP.3 KP.2.7 KP.5 JN.1.13 LB.1.7 KP.3.3 KP.4.1.3 JN.1.43.1 JN.1.42.2 JN.1.42 LL.1 JN.1.55.2 JN.1.55 JN.1.48 JN.1.49.2 JN.1.49.1 JN.1.49 LE.1.1 JN.1.4.7 LE.1 B.1.408 B.1.265 BA.2.68 AY.46.1 GK.1.1.1 XBB.1.5.50 CP.7 KP.2.14 BQ.1.1.40 N.8 B.53 KP.3.2.2 B.1.160.16 XCG JN.1.52 XCV B.1.388 KP.2.5 XCZ JV.2 XDS HK.23.1 KP.2.1 BF.22 XDW C.14 JN.1.27 JN.1.7.7 JN.1.31 KM.1 XBB.1.16.18 BQ.1.11 FL.5 B.1.499 GY.4 XBB.1.23 BL.5 B.1.617.3 BN.4 XBB.1.5.96 XBB.1.16.10 JF.3 P.1.3 JN.1.7.2 B.1.177.39 JR.1 BA.1.20 B.1.640 FY.1.2.3 BE.12 HK.23.1.1 BF.7.21 GK.1.6 B.1.36.33 BQ.1.1.57 BR.4 AY.78 FR.1 JN.1.15 XBB.1.16.8 KP.2.12 JD.1.1.4 KR.1 JN.1.10 FL.1.2 B.1.591 XCS XEA XDN GJ.1.2.4 B.1.177.85	0.43085101 0.13103699 0.04617824 0.04617824 0.04617824 0.04617824 0.03149604 0.03149604 0.02785287 0.02785286 0.02785286 0.02785286 0.02785286 0.02575816 0.02061855 0.00094139 0.00068493 0.00055214 0.00040518 0.00040518 0.00038465 0.00023137 0.00023137 0.00014887 0.00013758 0.00013758 0.00013758 0.00012236 0.00012236 0.00012236 0.00000141 0.00000021 0.00000021 0.00000010 0.00000010 0.00000009 0.00000007 0.00000006 0.00000006 0.00000004 0.00000004 0.00000004 0.00000004 0.00000004 0.00000004 0.00000003 0.00000003 0.00000003 0.00000003 0.00000003 0.00000003 0.00000003 0.00000002 0.00000002 0.00000002 0.00000002 0.00000002 0.00000002 0.00000002 0.00000002 0.00000002 0.00000002 0.00000002 0.00000002 0.00000002 0.00000002 0.00000002 0.00000002 0.00000002 0.00000002 0.00000002 0.00000001 0.00000001 0.00000001 0.00000001 0.00000001 0.00000001 0.00000001 0.00000001 0.00000001 0.00000001 0.00000001 0.00000001 0.00000001 0.00000001 0.00000001 0.00000001 0.00000001 0.00000001 0.00000001 0.00000001 0.00000001 0.00000001 0.00000001 0.00000001 0.00000001 0.00000001 0.00000001 0.00000001 0.00000001 0.00000001	4.311269386004394	79.98862990335418
06_24_24_SBJUN23_R2__E0000000__X00__240627_2_SG_WW__001.tsv	[('LB.1* (LB.1.X)', np.float64(0.5382589283577283)), ('KP.2* (KP.2.X)', np.float64(0.17886445057778977)), ('BA.2.86* (BA.2.86.X)', np.float64(0.17202465539717773)), ('JN.1.7* (JN.1.7.X)', np.float64(0.10082213325894408)), ('KP.3* (KP.3.X)', np.float64(0.009849032486777116)), ('XBB* (XBB.X)', np.float64(0.00014998680322412595)), ('Omicron', np.float64(3.175843477078352e-05)), ('Other', np.float64(2.9896100591171674e-06)), ('A', np.float64(6.718844270480714e-07)), ('BA.2.75* [Omicron (BA.2.75.X)]', np.float64(5.93090379582085e-07)), ('JN.1.18* (JN.1.18.X)', np.float64(4.998628660011224e-07)), ('XBB.1.16* [Omicron (XBB.1.16.X)]', np.float64(2.84607508706967e-07)), ('Delta', np.float64(2.1053086395191728e-07)), ('CH.1.1* [Omicron (CH.1.1.X)]', np.float64(1.3907229280214e-07)), ('XBB.1.5* [Omicron (XBB.1.5.X)]', np.float64(1.2165987101469226e-07)), ('EG.5* [Omicron (EG.5.X)]', np.float64(1.0828415364136562e-07)), ('XBB.2.3* (XBB.2.3X)', np.float64(8.20391930265733e-08)), ('XBB.1.9.1* [Omicron (XBB.1.9.1.X)]', np.float64(3.870299839695837e-08)), ('Alpha', np.float64(3.302221276692217e-08)), ('XBB.1.9.2* [Omicron (XBB.1.9.2.X)]', np.float64(3.2219956855161935e-08))]	LB.1.1 KP.5 JN.1.7.3 KP.2.2 KP.2.5 KP.2 LF.3 KP.2.3.3 KP.2.3.2 KP.3.3 JN.1.58.2 KP.2.15 JN.1.57.1 JN.1.3 JN.1.50.1 JN.1.35 JN.1.10 LE.1.2 JN.1.52 JN.1.25.1 JQ.1 KR.1.1 JN.1.49.1 JN.1.29 KP.1.1.3 LF.1.1.1 LD.1 KP.2.9 JN.3.2.1 JN.1.55 XBB.8 LM.1 KP.4.2.2 LB.1.5 JN.1.54 BA.2.10.4 JN.1.36 XBB.1.41.2 KP.2.16 XBB.9 B.1.637.1 LF.3.1 A.2.4 CJ.1.1 JN.1.32.1 JN.1.32 JN.1.18 JN.1.9.2 LE.2 BF.42 BA.2.3.7 JM.1 BQ.1.1.54 BF.7.4.1 XBB.6 JN.1.27 FK.1.2.2 LU.1 KP.3.2.3 LW.1 B.1.177.26 CN.2 GK.1.10 XCV B.1.177.39 AY.73 XAW ER.1.1 GA.8.1 JN.1.8.3 LE.1.3.1 HK.22 JN.1.43.1 JN.1.31 B.1.389 B.1.640.2 BS.1 B.1.438.4 XCW LB.1.3 LB.1.4 LK.1 JN.1.7.6 XD Q.5 EG.1.4 GW.3 A.2.5 AY.21 FR.1.3 BG.2 JN.1.47 BA.1.1.5 B.1.177.34 AY.39.1.4 BF.5.3 KP.2.14 KP.2.7 HE.1 FL.1.2 BS.1.2 JN.1.9.1 XBB.1.34.1 A.28 KH.1 BP.1 JN.1.44.1 HK.34 XBB.2.3.1 B.1.619.1 B.1.1.330 BE.9 XBJ.1.1 KP.1.1.4 JN.5.1 JN.1.58.1 JN.1.48.2 LB.1.6 XJ JN.1.18.4 EV.1 BN.1.3.11 XDP JN.1.2.1 XBC.1.1.2 CK.1.2 JD.1.1.4 KP.2.3.1 EG.5.2.2 JN.1.47.2 AA.5 B.1.622 XH AY.20.1 HK.16 XDQ.2 DG.1 XBF.8 HH.1.1 XBB.5 B.1.568 XBB.7 GL.2 BA.2.9.7 AF.1 B.1.641 CM.8.1.5 AY.43.6 B.1.36.25 JN.1.36.1 CK.1.1.1 B.1.160.9 CP.7 XBB.8.1 AY.127.3 JN.2.4 XBV CP.1.1 XBB.6.1 BQ.1.1.59 BE.1.4.3 HN.4.2 GK.1.10.1 JN.1.11 KP.2.1 JN.1.14 GW.1 CM.8.1.4 BA.2.3.22 AY.127.2 A.2.5.1 KP.2.3 JN.1.5 JN.1.7.7 B.1.160.20 JC.5.1 LV.2 AY.25.2 BF.7.5.1 JN.1.7 JN.1.11.1 JN.1.58 JN.1.50 JN.1.25 JN.1.49 JN.1.48.1 KG.2 GJ.1.2.3 B.1.177.27 GM.3.1 JN.1.28 JN.1.9 JN.1.8 JN.1 BA.2.86.3 AY.91.1 DY.3 XBC.1.6.5 JN.1.23 AY.121.1 FG.1 K.2	0.53820355 0.13322939 0.10082204 0.07160390 0.04084511 0.04084511 0.03013629 0.01213304 0.01213304 0.00984882 0.00407016 0.00115001 0.00080685 0.00048808 0.00040121 0.00029524 0.00029177 0.00027103 0.00024816 0.00022212 0.00019651 0.00018836 0.00016280 0.00015607 0.00014782 0.00012814 0.00012741 0.00012708 0.00011146 0.00011067 0.00010438 0.00009311 0.00006323 0.00005528 0.00004557 0.00003011 0.00002890 0.00002762 0.00002705 0.00001761 0.00000217 0.00000160 0.00000061 0.00000055 0.00000048 0.00000048 0.00000048 0.00000048 0.00000041 0.00000036 0.00000029 0.00000028 0.00000022 0.00000016 0.00000016 0.00000014 0.00000013 0.00000011 0.00000011 0.00000011 0.00000010 0.00000009 0.00000008 0.00000008 0.00000007 0.00000007 0.00000006 0.00000006 0.00000006 0.00000006 0.00000006 0.00000005 0.00000005 0.00000005 0.00000005 0.00000005 0.00000005 0.00000004 0.00000004 0.00000004 0.00000004 0.00000004 0.00000004 0.00000004 0.00000003 0.00000003 0.00000003 0.00000003 0.00000003 0.00000003 0.00000003 0.00000003 0.00000003 0.00000003 0.00000003 0.00000003 0.00000003 0.00000003 0.00000003 0.00000003 0.00000003 0.00000003 0.00000003 0.00000002 0.00000002 0.00000002 0.00000002 0.00000002 0.00000002 0.00000002 0.00000002 0.00000002 0.00000002 0.00000002 0.00000002 0.00000002 0.00000002 0.00000002 0.00000002 0.00000002 0.00000002 0.00000002 0.00000002 0.00000002 0.00000002 0.00000002 0.00000002 0.00000002 0.00000002 0.00000002 0.00000002 0.00000002 0.00000002 0.00000002 0.00000002 0.00000002 0.00000002 0.00000002 0.00000002 0.00000001 0.00000001 0.00000001 0.00000001 0.00000001 0.00000001 0.00000001 0.00000001 0.00000001 0.00000001 0.00000001 0.00000001 0.00000001 0.00000001 0.00000001 0.00000001 0.00000001 0.00000001 0.00000001 0.00000001 0.00000001 0.00000001 0.00000001 0.00000001 0.00000001 0.00000001 0.00000001 0.00000001 0.00000001 0.00000001 0.00000001 0.00000001 0.00000001 0.00000001 0.00000001 0.00000001 0.00000001 0.00000001 0.00000001 0.00000001 0.00000001 0.00000001 0.00000001 0.00000001 0.00000001 0.00000001 0.00000001 0.00000001 0.00000001 0.00000001 0.00000001 0.00000001 0.00000001 0.00000001 0.00000001 0.00000001 0.00000001 0.00000001 0.00000001 0.00000001 0.00000001 0.00000001 0.00000001	6.120590001565618	95.89673276928737
06_24_24_PLJUN18_R2__E0000000__X00__240627_2_SG_WW__001.tsv	[('BA.2.86* (BA.2.86.X)', np.float64(0.46885400320183784)), ('JN.1.18* (JN.1.18.X)', np.float64(0.24409504016227385)), ('KP.3* (KP.3.X)', np.float64(0.18591800017188204)), ('KP.2* (KP.2.X)', np.float64(0.10086691440968933)), ('LB.1* (LB.1.X)', np.float64(0.00026591958466067663)), ('Other', np.float64(1.4134150032485385e-07)), ('XBB* (XBB.X)', np.float64(4.249579270510315e-08)), ('Omicron', np.float64(4.146484142424165e-08)), ('A', np.float64(3.227675244946599e-08)), ('BA.2.75* [Omicron (BA.2.75.X)]', np.float64(1.2985564501344488e-08))]	KP.1.1 JN.1.18.5 KP.3.3 KP.1 KP.2 JN.1.11.1 KP.2.3.3 KP.2.3.2 JN.1.36 JN.1.48 KP.2.15 KP.1.1.3 JN.1.3 JN.1.17 LM.1 JN.1.21 KP.2.13 JN.1.29 JN.1.54 JN.18 JN.1.6.1 JN.1.6 LB.1.5 LE.2 JN.1.47.1 JN.1.38 KP.2.8 JN.1.10 LF.3 JN.1.5 KP.2.16 KP.1.1.5 KP.2.10 KP.2.9 JN.1.49.2 B.1.36.25 XBB.1.19.2 XDQ A.5 JN.3.2.1 B.1.36.20 BQ.1.1.28 BF.11.3 B.1.177.34 FR.1.3 JN.1.29.1 BA.1.16.1 B.53	0.25249167 0.24409504 0.18591800 0.13167422 0.06122484 0.05008020 0.01871952 0.01871948 0.01636900 0.01201200 0.00129365 0.00122800 0.00059503 0.00057902 0.00057741 0.00056818 0.00051520 0.00034064 0.00033244 0.00029393 0.00029238 0.00029207 0.00026592 0.00024936 0.00021101 0.00020640 0.00016224 0.00012669 0.00010150 0.00009667 0.00009362 0.00008111 0.00008103 0.00005734 0.00005505 0.00000006 0.00000004 0.00000004 0.00000003 0.00000002 0.00000002 0.00000002 0.00000001 0.00000001 0.00000001 0.00000001 0.00000001 0.00000001	7.2501938358737075	93.60599270976157
06_24_24_PLJUN16_R2__E0000000__X00__240627_2_SG_WW__001.tsv	[('BA.2.86* (BA.2.86.X)', np.float64(0.4563903647211259)), ('KP.2* (KP.2.X)', np.float64(0.36417128102692253)), ('KP.3.1.1* (KP.3.1.1.X)', np.float64(0.09474889927187881)), ('KP.3* (KP.3.X)', np.float64(0.07169909923774097)), ('Other', np.float64(0.012990395440467492)), ('Delta', np.float64(7.897769385191075e-08)), ('BA.2.75* [Omicron (BA.2.75.X)]', np.float64(2.4778724386540314e-08)), ('XBB* (XBB.X)', np.float64(1.309206095832593e-08))]	JN.1.11 KP.2.3 JN.1.11.1 KP.3.1.1 KP.2.5 KP.2 JN.1.16.2 KP.3 LA.1 KP.1 KP.2.3.2 KP.2.3.3 KP.1.1 KP.3.3 XDP.1 KP.2.2 KP.2.15 KP.2.8 KP.1.1.4 LF.3 LV.1 JN.1.27 XDQ KP.2.16 JN.1.19 KP.3.2.4 XEB KP.1.1.3 KP.2.9 XDV.1 JN.3.2.1 JN.5.1 XDV XCW AY.40 KP.2.13 XDK.1 FR.1.3 B.1.593 AY.121.1 XBB.1.20 B.1.626	0.18441283 0.16033560 0.09599048 0.09474890 0.07085448 0.07085448 0.06468661 0.05769018 0.05220598 0.03050801 0.03015170 0.03015170 0.02741677 0.01391670 0.01272982 0.00060117 0.00056529 0.00048112 0.00035075 0.00022222 0.00018955 0.00013885 0.00012062 0.00011802 0.00011191 0.00009222 0.00008641 0.00007687 0.00005767 0.00005322 0.00004273 0.00003681 0.00000016 0.00000010 0.00000007 0.00000006 0.00000003 0.00000002 0.00000002 0.00000001 0.00000001 0.00000001	6.697996987606444	95.82984984784136
06_24_24_ENCJUN20_R2__E0000000__X00__240627_2_SG_WW__001.tsv	[('LB.1* (LB.1.X)', np.float64(0.6608805998799383)), ('BA.2.86* (BA.2.86.X)', np.float64(0.12181417923593046)), ('KP.3.1.1* (KP.3.1.1.X)', np.float64(0.11145499818606003)), ('KP.2* (KP.2.X)', np.float64(0.050364364637004916)), ('Omicron', np.float64(0.049645399817062646)), ('KP.3* (KP.3.X)', np.float64(0.005444746239367417)), ('Other', np.float64(0.0003957083589913793))]	LB.1 KP.3.1.1 JN.1.16.1 LB.1.1 XDY KP.2.3.3 KP.2.3.2 LB.1.7 JN.1.27 JN.1.14 KS.1.1 KP.3.3 LB.1.3 KP.2.3.1 JN.1.47.1 KP.2.15 JN.1.8.2 LF.1.1 JN.1.39.3 JN.1.1.6 JN.1.6.1 JN.1.17 LB.1.6 JN.1.48.2 KP.3.2.3 LE.1.2 JN.1.55.2 LM.1 KP.2.2 KR.1.1 LN.1.1 LF.3 JN.1.3 JN.3.2.1 JN.1.31 XDT JN.1.29.1 XDP.1 LP.2 KP.2.16 KP.1.1.3 XDQ.1.1 XDK.1.2 LV.2 B.1.177.34 B.1.36.37 B.1.637 B.1.36.33 JN.1.49.1 B.1.438.4 JN.1.41 LV.1	0.54455383 0.11145500 0.09523097 0.08795760 0.04964540 0.02411765 0.02411765 0.02394110 0.00905409 0.00751869 0.00641731 0.00526009 0.00424178 0.00154600 0.00043029 0.00038188 0.00031701 0.00031374 0.00028522 0.00023356 0.00019164 0.00018776 0.00018629 0.00018491 0.00018465 0.00017881 0.00015321 0.00013892 0.00013384 0.00012652 0.00012310 0.00011512 0.00011262 0.00010205 0.00008921 0.00008874 0.00008713 0.00007449 0.00007118 0.00006734 0.00006270 0.00005914 0.00005833 0.00005052 0.00003664 0.00002462 0.00002235 0.00002059 0.00001926 0.00001081 0.00000989 0.00000874	4.949829829021391	96.78627562451928
06_24_24_PLJUN19_R1__E0000000__X00__240627_2_SG_WW__001.tsv	[('KP.3* (KP.3.X)', np.float64(0.3878739979500736)), ('BA.2.86* (BA.2.86.X)', np.float64(0.28896634212286415)), ('KP.2* (KP.2.X)', np.float64(0.16240414205159656)), ('LB.1* (LB.1.X)', np.float64(0.16029749860339015)), ('Other', np.float64(0.0004579933629132655)), ('XBB.1.5* [Omicron (XBB.1.5.X)]', np.float64(3.5570236116573084e-08)), ('A', np.float64(2.8579779374204205e-08))]	KP.3.2 KP.1.1 KP.3.1 KP.2 LB.1.1 LB.1.3 KP.2.3.1 KP.1.1.1 KP.1.1.5 KP.2.10 KP.1.2 KP.5 KP.2.15 KP.2.13 KP.2.2 LF.3 XDP.3 KP.3.2.4 KP.2.9 XDP.1 XDV JN.1.29.1 KP.2.16 XDQ.1.1 JQ.2 GN.1.4 A.19	0.21850269 0.21840510 0.16920700 0.08437123 0.08094970 0.07934780 0.04971890 0.03432690 0.03319108 0.02673642 0.00134591 0.00133285 0.00058879 0.00040420 0.00038835 0.00028461 0.00024012 0.00016431 0.00014370 0.00010541 0.00008353 0.00006342 0.00005255 0.00002893 0.00001646 0.00000004 0.00000003	7.308744739528573	93.75647928301508
06_24_24_ENCJUN19_R2__E0000000__X00__240627_2_SG_WW__001.tsv	[('KP.2* (KP.2.X)', np.float64(0.5142496638641402)), ('LB.1* (LB.1.X)', np.float64(0.3056271660473019)), ('Omicron', np.float64(0.09564798688011393)), ('BA.2.86* (BA.2.86.X)', np.float64(0.07934894219608282)), ('KP.3* (KP.3.X)', np.float64(0.00392926355192215)), ('JN.1.18* (JN.1.18.X)', np.float64(0.0010932353252039021)), ('Other', np.float64(0.00010412794303277146)), ('XBB.1.5* [Omicron (XBB.1.5.X)]', np.float64(6.045540103488175e-08)), ('XBB* (XBB.X)', np.float64(5.340208999317277e-08)), ('BA.2.75* [Omicron (BA.2.75.X)]', np.float64(2.385959477431912e-08)), ('XBB.1.16* [Omicron (XBB.1.16.X)]', np.float64(2.2395771662177182e-08)), ('Delta', np.float64(2.2339901005758704e-08)), ('XBB.1.9.1* [Omicron (XBB.1.9.1.X)]', np.float64(1.8808566341766853e-08)), ('CH.1.1* [Omicron (CH.1.1.X)]', np.float64(1.2593788719008111e-08)), ('EG.5* [Omicron (EG.5.X)]', np.float64(1.0125294683290822e-08))]	KP.2.4 LB.1.1 XDY KP.1.1 KP.2.5 KP.2 KP.2.2 KP.2.3.3 KP.2.3.2 LB.1.2 LB.1.2.1 KP.1.1.3 KP.3.3 LQ.1 LB.1.4 KP.2.9 KP.1.1.2 LW.1 KP.3.2.3 JN.1.14 KS.1 JN.1.31 XDQ LE.2 LE.1.3.1 N.5 B.36 KP.2.11 FN.1 BA.2.25.1 KM.1 XBB.1.19.2 LM.1 XBB.1.19 B.1.9.4 FR.1.3 BA.5.2.35 AY.11 B.1.1.422 B.1.1.348 FL.14 JB.1.1 KP.4.2.1 KP.1 JN.1.11.1 BA.5.1.32 B.1.36.33 JN.1.4.8 CH.1.1.16 GY.8 JN.1.11 XBB.1.16.25 EG.5.1.12	0.33111776 0.28311917 0.09564783 0.07465773 0.06218780 0.06218780 0.02444951 0.01695680 0.01695680 0.01087721 0.01087721 0.00383820 0.00355999 0.00109324 0.00075357 0.00039312 0.00035704 0.00018464 0.00018464 0.00014405 0.00013511 0.00010822 0.00010379 0.00006680 0.00004168 0.00000015 0.00000011 0.00000007 0.00000007 0.00000006 0.00000004 0.00000003 0.00000003 0.00000002 0.00000002 0.00000002 0.00000002 0.00000002 0.00000002 0.00000002 0.00000002 0.00000002 0.00000002 0.00000002 0.00000002 0.00000001 0.00000001 0.00000001 0.00000001 0.00000001 0.00000001 0.00000001 0.00000001	7.220253391659069	93.38527906898973
