	summarized	lineages	abundances	resid	coverage
05_28_24_PLMAY22_R1__E0000000__X00__240624_1_SG_WW__001.tsv	[('BA.2.86* (BA.2.86.X)', np.float64(0.8787587548238112)), ('JN.1.7* (JN.1.7.X)', np.float64(0.11874710378561591)), ('KP.2* (KP.2.X)', np.float64(0.0024938232012134054)), ('Other', np.float64(1.020924284859488e-06)), ('Omicron', np.float64(2.5262325113469283e-07)), ('KP.3* (KP.3.X)', np.float64(1.9724179812291946e-07)), ('XBB.1.5* [Omicron (XBB.1.5.X)]', np.float64(1.3665684166767577e-07)), ('Delta', np.float64(5.242518796454158e-08)), ('XBB.1.9.1* [Omicron (XBB.1.9.1.X)]', np.float64(2.6357389709599923e-08)), ('LB.1* (LB.1.X)', np.float64(2.300847859217238e-08)), ('XBB* (XBB.X)', np.float64(2.0890531342815804e-08)), ('EG.5* [Omicron (EG.5.X)]', np.float64(1.018360451151665e-08))]	JN.1.11.1 KP.5 JN.1.7.4 JN.1.36.1 JN.1.36 KP.1.1.1 KP.2.15 B.1.408 EE.1 B.1.265 KM.1 KP.3.1 KP.3.1.3 AY.21 BA.5.1.19 KR.1 KR.1.2 B.1.177.87 LB.1.3 XBB.1.5.96 XAH KP.2.1 KP.2 KP.2.7 BF.22 FL.1.2 B.6.8 XDP.1 FL.2.6 JN.1.29.1 XCG JC.5.1 XCW XBB.1.23 HK.27	0.41694781 0.38125290 0.11874710 0.02916788 0.02916788 0.02222221 0.00249377 0.00000080 0.00000017 0.00000014 0.00000012 0.00000010 0.00000010 0.00000005 0.00000005 0.00000003 0.00000003 0.00000003 0.00000002 0.00000002 0.00000002 0.00000002 0.00000002 0.00000002 0.00000002 0.00000001 0.00000001 0.00000001 0.00000001 0.00000001 0.00000001 0.00000001 0.00000001 0.00000001 0.00000001	4.189151133977134	72.67163829716083
05_28_24_ENCMAY27_R2__E0000000__X00__240624_1_SG_WW__001.tsv	[('BA.2.86* (BA.2.86.X)', np.float64(0.8045376210325318)), ('LB.1* (LB.1.X)', np.float64(0.09607800042766855)), ('JN.1.18* (JN.1.18.X)', np.float64(0.044040902904266384)), ('JN.1.7* (JN.1.7.X)', np.float64(0.03089499688143214)), ('KP.2* (KP.2.X)', np.float64(0.024311046882402352)), ('Other', np.float64(0.00013746573253395458)), ('XBB* (XBB.X)', np.float64(3.7873893366562906e-08)), ('Omicron', np.float64(3.027463951302714e-08)), ('Delta', np.float64(2.8461806547608744e-08)), ('CH.1.1* [Omicron (CH.1.1.X)]', np.float64(2.3323316588659772e-08))]	JN.1.11 JN.1.16.1 JN.1.16 LB.1.1 JN.1.18.1 JN.1.7.4 KP.2.4 LQ.3 JN.1.7.5 JN.1.47.1 LN.1 KP.2.3.3 KP.2.3.2 JN.1.25 JN.1.25.1 JN.1.7.6 JN.1.3 KP.2.16 JN.1.55.1 LF.1.1 JN.1.48.1 JN.1.29.1 JN.1.27 LM.1 JN.1.49 JN.1.49.1 KP.4.1.3 JN.1.36 XDQ.2 LF.3 JN.1.4.4 JN.1.4 XDD XDP.1 JN.1.4.8 B.1.488 CH.1.1.9 XCW BE.1.4.1 AY.73 XBB.1.48 AY.21 XBB.1.20 B.1.177.4 EE.1 JC.5	0.29589733 0.25268711 0.25268711 0.09607800 0.04326067 0.02990034 0.02340730 0.00078023 0.00074850 0.00060606 0.00040374 0.00034882 0.00034881 0.00025664 0.00025664 0.00024615 0.00020618 0.00020613 0.00019686 0.00019008 0.00018949 0.00015042 0.00012737 0.00012267 0.00011431 0.00011431 0.00008760 0.00008125 0.00008119 0.00007322 0.00004455 0.00004455 0.00003493 0.00002123 0.00000010 0.00000009 0.00000002 0.00000002 0.00000002 0.00000002 0.00000001 0.00000001 0.00000001 0.00000001 0.00000001 0.00000001	5.0750383095441425	90.97749389693342
05_28_24_PLMAY21_R1__E0000000__X00__240624_1_SG_WW__001.tsv	[('KP.2* (KP.2.X)', np.float64(0.6176569062241055)), ('BA.2.86* (BA.2.86.X)', np.float64(0.35832364159453794)), ('JN.1.18* (JN.1.18.X)', np.float64(0.016265702350901034)), ('LB.1* (LB.1.X)', np.float64(0.006631090778500659)), ('KP.3* (KP.3.X)', np.float64(0.0006597503154130942)), ('Other', np.float64(0.0002700817397806317)), ('JN.1.7* (JN.1.7.X)', np.float64(0.0001762936250707747)), ('Omicron', np.float64(1.6514188094721064e-05))]	KP.2 KP.2.5 KP.5 LF.1 JN.1.18 JN.1.16.1 JN.1.18.3 JN.1.18.5 JN.1.9.2 LB.1 JN.1.32.1 JN.1.16.3 JN.1.32 KP.1.1.3 JN.1.51.1 JN.1.51 KP.2.15 KP.4.2.1 JN.1.25.1 LB.1.2.1 LB.1.2 JN.1.52 KP.3.1.2 JN.1.22 JN.1.27 KP.2.12 JN.1.8.2 JN.1.8.1 KR.1.1 JN.1.50.1 LE.1.1 LE.1 JQ.2 JN.1.7.3 JN.1.19 KP.3.2.4 XDK.1.1 XDP.1 JN.1.55.1 KP.2.16 KP.2.3.2 KP.2.3.3 JN.1.6.1 JN.1.48 JN.1.3 LV.2 LE.2 JN.1.48.2 JN.1.53.1 LF.3.1 JN.1.49.1 JN.3.2.1 KP.2.2 JN.5.1 BF.11.3 BA.2.86.1 JN.5 XDV.1	0.30816483 0.30816445 0.18857302 0.13492100 0.00542190 0.00542190 0.00542190 0.00542190 0.00542190 0.00542190 0.00536207 0.00536207 0.00536207 0.00081059 0.00078370 0.00078370 0.00066327 0.00065833 0.00062494 0.00060459 0.00060459 0.00054855 0.00052056 0.00043459 0.00029464 0.00026323 0.00026153 0.00026139 0.00026063 0.00024925 0.00023396 0.00023396 0.00022642 0.00017629 0.00015816 0.00013919 0.00013609 0.00013059 0.00012563 0.00011851 0.00011673 0.00011673 0.00011531 0.00010377 0.00010222 0.00009857 0.00009373 0.00008196 0.00007465 0.00007361 0.00006973 0.00006845 0.00004915 0.00004347 0.00001651 0.00001511 0.00000906 0.00000340	4.5694381371851795	93.19131859679631
05_28_24_PLMAY19_R1__E0000000__X00__240624_1_SG_WW__001.tsv	[('LB.1* (LB.1.X)', np.float64(0.8364603993814131)), ('BA.2.86* (BA.2.86.X)', np.float64(0.0930294866205034)), ('JN.1.7* (JN.1.7.X)', np.float64(0.04340569456932259)), ('KP.3* (KP.3.X)', np.float64(0.02680461854607773)), ('Other', np.float64(0.00030003015381904085)), ('XBB* (XBB.X)', np.float64(8.622596189862055e-08)), ('Omicron', np.float64(6.44859634041831e-08)), ('Delta', np.float64(4.2364934988382796e-08)), ('Iota', np.float64(2.738149190626546e-08)), ('XBB.1.16* [Omicron (XBB.1.16.X)]', np.float64(2.2780733471311193e-08)), ('EG.5* [Omicron (EG.5.X)]', np.float64(1.0671854220422407e-08))]	LB.1.1 JN.1.16.3 JN.1.7.4 KP.3.3 JN.1.39 JN.1.16 JN.1.53.1 JN.1.3 JN.1.29.1 XEB JN.1.39.1 JN.1.5 KR.1 LF.3 JN.1.36 B.1.187 XBB.1.49 XBB.9 JN.1.7.5 AY.92 B.1.526 BA.5.2.7 FU.5 B.1.408 B.1.535 B.1.1.305 B.1.1.482 BQ.1.1.19 B.1.177.42 AY.73 GW.3 BT.1 BE.3 JR.1 B.1.177.12 B.1.177.43	0.83646040 0.05574141 0.04340566 0.02680462 0.02332426 0.01176311 0.00068964 0.00055803 0.00044523 0.00029974 0.00012633 0.00011017 0.00009989 0.00009186 0.00007957 0.00000018 0.00000004 0.00000004 0.00000003 0.00000003 0.00000003 0.00000002 0.00000002 0.00000002 0.00000002 0.00000002 0.00000002 0.00000002 0.00000001 0.00000001 0.00000001 0.00000001 0.00000001 0.00000001 0.00000001 0.00000001	3.2914383714787556	85.33257532689028
05_28_24_SBMAY21_R2__E0000000__X00__240624_1_SG_WW__001.tsv	[('KP.3* (KP.3.X)', np.float64(0.8172350839700131)), ('BA.2.86* (BA.2.86.X)', np.float64(0.17973223717528303)), ('KP.2* (KP.2.X)', np.float64(0.002810139424016521)), ('Other', np.float64(0.00022365258033989655)), ('Omicron', np.float64(1.0268072140169112e-06)), ('XBB* (XBB.X)', np.float64(5.386539252345507e-07)), ('XBB.1.9.1* [Omicron (XBB.1.9.1.X)]', np.float64(2.1788527293196476e-07)), ('Delta', np.float64(2.1277995247839567e-07)), ('XBB.1.5* [Omicron (XBB.1.5.X)]', np.float64(1.5503806545753754e-07)), ('A', np.float64(1.457424129569055e-07)), ('XBB.1.16* [Omicron (XBB.1.16.X)]', np.float64(6.403258522251307e-08)), ('BA.2.75* [Omicron (BA.2.75.X)]', np.float64(4.8166069268933234e-08)), ('CH.1.1* [Omicron (CH.1.1.X)]', np.float64(4.197742555895838e-08)), ('XBB.2.3* (XBB.2.3X)', np.float64(2.944981103309909e-08))]	KP.3.2 KP.3 LR.1 KP.3.1 KP.2.11 KP.3.2.2 KP.2.15 LA.1 LF.3 LM.1 KR.1.1 KP.2.13 JN.1.4.8 KP.2.16 KP.3.1.2 KP.3.2.3 KY.1 JN.1.47.1 JN.1.48.1 KP.2.10 LV.2 XDK.1.2 XDQ.2 JN.2.4 XDU JN.1.29.1 KP.4.1.3 LP.3 JQ.2.1.1 KP.1.1.3 KR.1 B.1.258.16 XBB.1.12.1 ET.1 B.1.36.20 XBF.8.1 BP.1 FL.1.5.2 GK.1.10 CP.7 GW.1.1 AY.73 XAW A.19 BF.7.4.2 XH JF.3 HN.4.1.1 HW.1.3 BF.5.3 AA.5 FK.1.2.2 A.9 LP.2 KP.3.2.5 XS LE.1.2 LG.1 AY.25.2 AY.127.2 KZ.1.1 CM.7.1.1 AY.3.3 EP.1.1.1 JN.1.53.1 KP.1.1.4 XY B.1.36.25 KP.1.1.2 BA.4.1.8 FR.1.3 AV.1 HH.8.1 AY.63 LE.1.3.1 KH.1 LN.1.1 KP.2.5 XDZ XBF.8 FR.1.5 KP.2.1 KP.2 A.2.5.3 JN.1.55.1 KP.2.12 XDV.1 JN.3.2.1 XDJ N.10 JN.1.58.1	0.34126407 0.31527120 0.17700600 0.15957672 0.00165015 0.00083152 0.00065261 0.00062164 0.00057340 0.00026302 0.00023258 0.00021412 0.00019780 0.00017791 0.00014618 0.00014536 0.00013867 0.00012376 0.00011540 0.00011530 0.00011412 0.00008203 0.00007336 0.00006986 0.00006676 0.00006638 0.00006129 0.00005437 0.00004770 0.00003599 0.00001003 0.00000096 0.00000041 0.00000029 0.00000021 0.00000017 0.00000016 0.00000016 0.00000016 0.00000015 0.00000013 0.00000013 0.00000013 0.00000010 0.00000007 0.00000006 0.00000006 0.00000006 0.00000006 0.00000005 0.00000004 0.00000004 0.00000004 0.00000003 0.00000003 0.00000003 0.00000003 0.00000003 0.00000002 0.00000002 0.00000002 0.00000002 0.00000002 0.00000002 0.00000002 0.00000002 0.00000002 0.00000002 0.00000002 0.00000002 0.00000002 0.00000002 0.00000002 0.00000001 0.00000001 0.00000001 0.00000001 0.00000001 0.00000001 0.00000001 0.00000001 0.00000001 0.00000001 0.00000001 0.00000001 0.00000001 0.00000001 0.00000001 0.00000001 0.00000001 0.00000001	7.74256555862352	92.01417917934656
05_28_24_PLMAY20_R1__E0000000__X00__240624_1_SG_WW__001.tsv	[('BA.2.86* (BA.2.86.X)', np.float64(0.8434044487233455)), ('KP.2* (KP.2.X)', np.float64(0.0802541995251637)), ('JN.1.7* (JN.1.7.X)', np.float64(0.052144292750457476)), ('LB.1* (LB.1.X)', np.float64(0.024196965576347443)), ('Other', np.float64(1.993955422372364e-07)), ('Omicron', np.float64(7.894262558672724e-08)), ('Delta', np.float64(4.8769528270496214e-08)), ('XBB.1.5* [Omicron (XBB.1.5.X)]', np.float64(2.19031299191717e-08)), ('EG.5* [Omicron (EG.5.X)]', np.float64(1.2251293308273686e-08))]	JN.1.11 KP.5 JN.1.48 KP.1.1.1 KP.2.16 JN.1.30 JN.1.36 LB.1.1 JN.1.7 JN.1.7.3 JN.1.7.1 KP.2.3.1 JN.1.21 JN.10 JN.1.25.1 JN.1.25 JN.1.7.6 JN.1.57.1 JN.1.48.2 JN.1.49.1 JN.1.49 LF.3 JN.3.2.1 JN.1.11.1 KP.2.5 KP.2 JN.1.7.4 B.1.330 B.1.509 BQ.1.1.60 BA.2.68 AY.92 AY.73 HK.27 B.1.408 GB.1 BA.4.1.8 XBB.1.5.50 B.1.265	0.33099077 0.18352870 0.11772421 0.10437900 0.07363110 0.06704439 0.03539409 0.02419697 0.01724627 0.01724627 0.01724627 0.00662250 0.00132626 0.00105518 0.00044913 0.00044913 0.00040518 0.00029336 0.00022472 0.00019394 0.00019394 0.00009349 0.00006381 0.00000030 0.00000030 0.00000030 0.00000029 0.00000013 0.00000005 0.00000003 0.00000003 0.00000003 0.00000002 0.00000001 0.00000001 0.00000001 0.00000001 0.00000001 0.00000001	4.354488557364227	84.40959101093536
05_28_24_ENCMAY24_R1__E0000000__X00__240624_1_SG_WW__001.tsv	[('LB.1* (LB.1.X)', np.float64(0.47498487827148705)), ('KP.3* (KP.3.X)', np.float64(0.2709183309376467)), ('BA.2.86* (BA.2.86.X)', np.float64(0.25142161115249223)), ('KP.2* (KP.2.X)', np.float64(0.002347396201021813)), ('Other', np.float64(0.00033832299804211266)), ('Omicron', np.float64(6.062845227108807e-06)), ('XBB* (XBB.X)', np.float64(3.7085828275302727e-06)), ('BA.2.75* [Omicron (BA.2.75.X)]', np.float64(1.1701358517758868e-06)), ('Delta', np.float64(1.1645467304087196e-06)), ('XBB.1.16* [Omicron (XBB.1.16.X)]', np.float64(7.049123887346581e-07)), ('JN.1.18* (JN.1.18.X)', np.float64(7.038173955287227e-07)), ('EG.5* [Omicron (EG.5.X)]', np.float64(6.010428070504377e-07)), ('XBB.1.5* [Omicron (XBB.1.5.X)]', np.float64(5.268765164133529e-07)), ('CH.1.1* [Omicron (CH.1.1.X)]', np.float64(3.6354867704966224e-07)), ('XBB.2.3* (XBB.2.3X)', np.float64(3.425736146758743e-07)), ('XBB.1.9.1* [Omicron (XBB.1.9.1.X)]', np.float64(2.4393907048428533e-07)), ('JN.1.7* (JN.1.7.X)', np.float64(1.1435853688568903e-07)), ('Gamma', np.float64(1.1402668168309957e-07)), ('A', np.float64(6.778732079246687e-08)), ('XBB.1.9.2* [Omicron (XBB.1.9.2.X)]', np.float64(3.06927315034233e-08)), ('Mu', np.float64(2.9719286902435144e-08)), ('Alpha', np.float64(1.728998857816909e-08)), ('Eta', np.float64(1.16703257243388e-08))]	KP.3.1 JN.1.16.1 LB.1 LB.1.1 LB.1.7 KP.1.1.3 KP.2.2 JN.1.15 BA.2.86.1 JN.1.27 JN.1.54 KP.2.16 XDP KP.2.3.3 KP.2.3.2 JN.3.2 JN.1.29.1 XEB XDV.1 LF.3 JN.1.48 B.1.1.345 GW.5.3 JN.1.58.1 B.1.423 BA.2.74 B.27 EE.1 CJ.1.2 XDQ BA.1.16.1 LH.1 KP.2.9 BF.5.4 BQ.1.25.1 JN.1.53.1 JN.1.57.1 B.1.177.85 XBB.1.16.10 XDQ.1.1 B.53 B.26 KP.3.1.3 HK.3.4 B.1.160.27 BA.5.1.10 N.5 XBB.1.5.74 AA.8 B.35 XCS AY.46.1 XBB.1.16.18 AY.122.3 BA.4.1.10 JN.1.8.3 JN.3.2.1 AY.62 BK.1 FL.5.1 JN.1.39.1 B.1.438 EE.4 XDQ.2 XDT CR.1.3 FR.1.3 KZ.1.1 HK.31 EJ.3 XBB.1.16.12 JN.1.31 M.1 JN.1.52 P.1.9 JN.1.48.1 JN.1.43.1 DN.1.1.3 XAY.1.1.2 AY.40 B.1.291 JN.4 BF.7.4.1 B.1.1.289 KP.2.3.1 B.1.177.36 GW.5.2 LM.1 AY.125.1 BF.7.16.1 BF.7.4 KP.2.8 JM.1 FK.1.3.2 B.12 JP.1.1 KP.4.2.2 JD.1.2.2 BA.2.76.2 XBJ.1.1 CP.7 JN.1.47.2 FL.1.2 XDQ.1 JN.1.47 BA.2.86.4 HK.13.2.1 BA.2.82 C.14 A.17 GW.5.3.1 B.1.438.4 GY.8 JN.1.18 JN.1.9.2 GK.1.6.1 JN.1.29 AY.29.2 LF.1.1 XDW JN.1.16 C.12 B.1.36.17 LU.1 AY.21 BF.7.4.2 KR.1.1 B.1.1.236 HK.3.13 JN.1.44.1 AY.87 AY.99.2 BA.5.2.12 JN.1.28.1 JN.1.56.1 CN.1 XCW LG.1 XCQ B.6.8 LE.1.3.1 JN.1.54.1 XDJ K.2 AY.73 LN.1 CK.2.1.1 B.4.6 GE.1.6 BA.5.2.19 JN.1.7.3 BG.2 KP.3.1.4 B.1.438.2 LP.1 XBB.2.3.15 B.1.36.27 B.1.9.3 B.1.177.26 LW.1 KP.3.2.3 JN.1.39.3 AY.39.1.4 JN.1.7.4 XBB.7 JN.1.48.2 GJ.1.2.3 XBB.2.6.3 XBR XBB.1.5.20 AY.78 LB.1.4 LB.1.2 LB.1.2.1 BN.1.3.6 B.1.258.16 B.1.393 FY.4.1.2 B.1.466.2 B.1.1.483 JR.1.1.1 XBC.1.1.2 B.1.389 XDY KP.3.1.2 XL XDP.1 B.1.1.486 BR.1.1 B.1.177.43 XBB.2.3.9 JN.1.14 HC.4 DV.1.1 JG.3.1 EV.1 B.1.177.4 JB.1.1 B.1.214.4 GK.2.1.1 LF.2 CH.1.1.15 HE.1 B.1.177.87 KL.1.1 LB.1.3 CM.8.1.2 CM.8.1.3 JQ.2.1 FY.1.2.3 LF.1 DV.7.1.3 JN.5.1 XBB.1.5.61 HK.21 KP.4.1.3 B.1.160.9 EG.5.1.10 P.4 JN.1.11 XBB.1.16.29 XBB.2.3.1 B.1.1.524 BA.5.2.43 GY.4 JT.1 JN.1.7.6 BA.5.10.1 JN.1.4.8 KV.1 XDZ KP.2.1 HK.11.1 JN.1.7.1 BT.1 HK.16 AY.101 AZ.6 KP.2 KP.2.5 CM.7.1.1 AY.43.1 AQ.2 BN.1.11 C.31 XAY.1.2 B.1.36.28 KT.1.2 JN.1.18.3 JN.1.50.1 HM.1 KP.3.1.5 LB.1.6 CK.3 B.1.36.9 P.1.8 KG.2 C.2.1 JE.1.1 XBA JW.1.1 XDC LP.3 AY.46.6.1 JQ.2 KP.3 BF.7.13 JN.1.47.1 BF.7.13.2 B.1.591 B.1.611 XBB.1.16.30 CH.1.1.8 AY.19 XBF.9 BF.5.3 HN.2.1 AM.4 XD JN.1.24.1 LE.1.2 KE.1 AU.2 GA.4.2 KZ.1 BE.13 B.43 JU.1 CM.8 AY.4.17 BA.5.1.33 JN.1.1.3 JR.1 XJ LS.1 DV.5 BE.9 GP.1 EG.10.1 XBC.1.6.1 AY.4.12 B.1.466.1 B.6.1 B.1.616 LP.2 JV.2 AY.24.1 B.1.36.33 XBB.1.16.25 LA.1 B.1.428.3 KD.2 B.1.615 LV.2 JN.1.1.6 KP.4.2.1 XAW BF.7.27 Q.8 HR.1.1 HV.1.1 AY.127.3 AY.91.1 BF.7.13.1 B.1.1.407 GK.1.1.1 LR.1 BA.5.12 GK.5.1 DV.6.1 B.1.622 BP.1 B.1.626 AY.127.2 AY.31 C.21 JN.1.60 AZ.5 JY.1.1 XDQ.3 CH.1.1.26 AH.1 FK.1.3.1 JN.1.42.2 AY.124.1.1 JD.1.1.5 HN.6 JN.1.38 XDV BF.11.2 AY.46.5 JS.1 BS.1.2 JN.1.57 AE.7 A.4 B.1.258.22 BB.2 FW.1.1.1 AY.121.1 BR.5.1 XCB FU.2 AY.3.3 XAC KP.2.7 KP.2.14 GJ.1.2.2 B.1.428.2 B.45 XBJ.3 N.2 JS.2 B.1.1.348 B.1.1.433 B.1.563 JF.4 JN.1.6.1 KP.2.6 GS.4.1.1 JN.1.18.5 B.1.621.2 LF.1.1.1 GJ.1.2.4 XDP.2 BE.1.4.3 P.1.10.1 B.1.629 BE.4.2 CK.1.4 FU.2.1 FL.2.6 LB.1.5 B.52 N.7 GT.1 BE.1.4.2 XAB XDF BA.5.2.8 JN.1.9 JN.1.8 JN.1.28 JN.1 XBB.2.3.21 AY.4.8 C.40 XCV LC.1 JN.1.40 KS.1 AY.98.1.1 B.1.531 FR.1.5 HH.8 FT.3 HV.1.2 LQ.1 JN.1.8.2 B.1.1.519 EG.1.8 XBB.1.12.1 B.6.2 CY.2 GN.1.4 JN.1.34 B.1.1.425 AY.39.1.2 LN.1.1 EP.1.1.1 XBC.1.6.6 JN.1.15.1 XDN BG.7 XBB.1.5.78 B.1.525 EP.1.1 DG.1 AY.122.5 B.1.177.34 BA.5.1.31 XCL KU.2 KC.1 KC.1.1 JN.1.44 BA.5.2.39 KP.1.1.2 XAM CP.1.2 B.1.177.41 BF.7.4.3 AY.20.1 JN.1.46 KS.1.2 AY.56 XBC.1.3 B.1.1.358 HE.2 JN.1.59 JQ.2.1.1 FK.1.2.2 LQ.3 P.1.3 GL.1 XBB.1.16.31 XBB.3.5 BA.5.2.58 AY.28 CH.1.1.14 AQ.1 B.1.640.2 AY.51 C.36.3.1 AD.2.1 EG.5.1.12 XBV B.1.641 JE.1.1.1 AY.120.2.1 B.1.243.2 DF.1	0.27091796 0.24186558 0.24186558 0.20201397 0.03110518 0.00673409 0.00177862 0.00101098 0.00085281 0.00033835 0.00029519 0.00026068 0.00018434 0.00015368 0.00015368 0.00012948 0.00010163 0.00007840 0.00006307 0.00004444 0.00004274 0.00000364 0.00000334 0.00000323 0.00000203 0.00000146 0.00000144 0.00000111 0.00000087 0.00000081 0.00000058 0.00000058 0.00000051 0.00000043 0.00000037 0.00000031 0.00000027 0.00000026 0.00000025 0.00000024 0.00000023 0.00000020 0.00000020 0.00000019 0.00000018 0.00000017 0.00000016 0.00000016 0.00000015 0.00000014 0.00000014 0.00000014 0.00000013 0.00000013 0.00000013 0.00000013 0.00000012 0.00000012 0.00000012 0.00000012 0.00000011 0.00000010 0.00000010 0.00000010 0.00000009 0.00000009 0.00000009 0.00000009 0.00000009 0.00000008 0.00000008 0.00000007 0.00000007 0.00000007 0.00000007 0.00000007 0.00000007 0.00000007 0.00000007 0.00000006 0.00000006 0.00000006 0.00000006 0.00000006 0.00000006 0.00000006 0.00000006 0.00000006 0.00000006 0.00000006 0.00000006 0.00000006 0.00000006 0.00000006 0.00000006 0.00000006 0.00000006 0.00000006 0.00000006 0.00000006 0.00000006 0.00000005 0.00000005 0.00000005 0.00000005 0.00000005 0.00000005 0.00000005 0.00000005 0.00000005 0.00000005 0.00000005 0.00000005 0.00000005 0.00000005 0.00000005 0.00000005 0.00000005 0.00000005 0.00000005 0.00000005 0.00000004 0.00000004 0.00000004 0.00000004 0.00000004 0.00000004 0.00000004 0.00000004 0.00000004 0.00000004 0.00000004 0.00000004 0.00000004 0.00000004 0.00000004 0.00000004 0.00000004 0.00000004 0.00000004 0.00000004 0.00000004 0.00000004 0.00000004 0.00000004 0.00000004 0.00000004 0.00000004 0.00000004 0.00000004 0.00000004 0.00000004 0.00000004 0.00000004 0.00000003 0.00000003 0.00000003 0.00000003 0.00000003 0.00000003 0.00000003 0.00000003 0.00000003 0.00000003 0.00000003 0.00000003 0.00000003 0.00000003 0.00000003 0.00000003 0.00000003 0.00000003 0.00000003 0.00000003 0.00000003 0.00000003 0.00000003 0.00000003 0.00000003 0.00000003 0.00000003 0.00000003 0.00000003 0.00000003 0.00000003 0.00000003 0.00000003 0.00000003 0.00000003 0.00000003 0.00000003 0.00000003 0.00000003 0.00000003 0.00000003 0.00000003 0.00000003 0.00000003 0.00000003 0.00000003 0.00000003 0.00000003 0.00000003 0.00000003 0.00000003 0.00000003 0.00000003 0.00000003 0.00000003 0.00000003 0.00000002 0.00000002 0.00000002 0.00000002 0.00000002 0.00000002 0.00000002 0.00000002 0.00000002 0.00000002 0.00000002 0.00000002 0.00000002 0.00000002 0.00000002 0.00000002 0.00000002 0.00000002 0.00000002 0.00000002 0.00000002 0.00000002 0.00000002 0.00000002 0.00000002 0.00000002 0.00000002 0.00000002 0.00000002 0.00000002 0.00000002 0.00000002 0.00000002 0.00000002 0.00000002 0.00000002 0.00000002 0.00000002 0.00000002 0.00000002 0.00000002 0.00000002 0.00000002 0.00000002 0.00000002 0.00000002 0.00000002 0.00000002 0.00000002 0.00000002 0.00000002 0.00000002 0.00000002 0.00000002 0.00000002 0.00000002 0.00000002 0.00000002 0.00000002 0.00000002 0.00000002 0.00000002 0.00000002 0.00000002 0.00000002 0.00000002 0.00000002 0.00000002 0.00000002 0.00000002 0.00000002 0.00000002 0.00000002 0.00000002 0.00000002 0.00000002 0.00000002 0.00000002 0.00000002 0.00000002 0.00000002 0.00000002 0.00000002 0.00000002 0.00000002 0.00000002 0.00000002 0.00000002 0.00000002 0.00000002 0.00000002 0.00000002 0.00000002 0.00000002 0.00000002 0.00000002 0.00000002 0.00000002 0.00000002 0.00000002 0.00000002 0.00000002 0.00000002 0.00000002 0.00000002 0.00000002 0.00000002 0.00000002 0.00000002 0.00000002 0.00000002 0.00000002 0.00000002 0.00000002 0.00000002 0.00000002 0.00000002 0.00000002 0.00000002 0.00000002 0.00000002 0.00000002 0.00000002 0.00000002 0.00000002 0.00000002 0.00000002 0.00000002 0.00000002 0.00000002 0.00000002 0.00000002 0.00000002 0.00000002 0.00000002 0.00000002 0.00000002 0.00000002 0.00000002 0.00000002 0.00000002 0.00000002 0.00000002 0.00000002 0.00000002 0.00000002 0.00000002 0.00000002 0.00000002 0.00000002 0.00000002 0.00000002 0.00000002 0.00000002 0.00000002 0.00000002 0.00000002 0.00000002 0.00000001 0.00000001 0.00000001 0.00000001 0.00000001 0.00000001 0.00000001 0.00000001 0.00000001 0.00000001 0.00000001 0.00000001 0.00000001 0.00000001 0.00000001 0.00000001 0.00000001 0.00000001 0.00000001 0.00000001 0.00000001 0.00000001 0.00000001 0.00000001 0.00000001 0.00000001 0.00000001 0.00000001 0.00000001 0.00000001 0.00000001 0.00000001 0.00000001 0.00000001 0.00000001 0.00000001 0.00000001 0.00000001 0.00000001 0.00000001 0.00000001 0.00000001 0.00000001 0.00000001 0.00000001 0.00000001 0.00000001 0.00000001 0.00000001 0.00000001 0.00000001 0.00000001 0.00000001 0.00000001 0.00000001 0.00000001 0.00000001 0.00000001 0.00000001 0.00000001 0.00000001 0.00000001 0.00000001 0.00000001 0.00000001 0.00000001 0.00000001 0.00000001 0.00000001 0.00000001 0.00000001 0.00000001 0.00000001 0.00000001 0.00000001 0.00000001 0.00000001 0.00000001 0.00000001 0.00000001 0.00000001 0.00000001 0.00000001 0.00000001 0.00000001 0.00000001 0.00000001 0.00000001 0.00000001 0.00000001 0.00000001 0.00000001 0.00000001 0.00000001 0.00000001 0.00000001 0.00000001 0.00000001 0.00000001 0.00000001 0.00000001 0.00000001 0.00000001 0.00000001 0.00000001 0.00000001 0.00000001 0.00000001 0.00000001 0.00000001 0.00000001 0.00000001 0.00000001 0.00000001	3.79625433389868	87.56980904925928
05_28_24_SBMAY23_R1__E0000000__X00__240624_1_SG_WW__001.tsv	[('JN.1.7* (JN.1.7.X)', np.float64(0.701865998841723)), ('BA.2.86* (BA.2.86.X)', np.float64(0.296249227956117)), ('LB.1* (LB.1.X)', np.float64(0.0008471797176579775)), ('JN.1.18* (JN.1.18.X)', np.float64(0.0005470450929121517)), ('KP.3* (KP.3.X)', np.float64(0.0004280816455612073)), ('Other', np.float64(6.245937812114696e-05)), ('XBB.1.16* [Omicron (XBB.1.16.X)]', np.float64(2.8265246683779014e-08))]	JN.1.7 JN.1.11 JN.1.57 JN.1.7.4 JN.1.28 JN.1 JN.1.8 JN.1.16 JN.1.21 JN.1.34 JN.1.38 JN.1.7.7 JN.1.58 LB.1.4 LH.1 JN.1.4 BA.2.86.1 JN.1.47 JN.1.25 JN.1.43.1 KP.3.2.5 JN.1.3 JN.1.23 JN.1.27 JN.1.48.2 LB.1.5 BA.2.86.7 JN.1.55.1 LM.1 JN.1.53.1 KP.3.2.3 LF.3 XDP.1 JN.3.2.1 XBB.1.16.10 B.1.408	0.67065375 0.11578592 0.09970598 0.03049433 0.01836674 0.01836674 0.01836674 0.01167317 0.00606061 0.00249066 0.00116144 0.00071791 0.00069053 0.00066845 0.00054705 0.00045640 0.00043770 0.00041911 0.00035360 0.00035340 0.00031723 0.00028585 0.00026731 0.00023903 0.00018132 0.00017873 0.00014802 0.00012504 0.00011449 0.00011345 0.00011085 0.00006770 0.00006243 0.00001828 0.00000003 0.00000003	2.679398826490318	91.5928167742367
