	summarized	lineages	abundances	resid	coverage
07_15_24_SBJUL14_R2__E0000000__X00__240718_SG_WW__001.tsv	[('KP.2* (KP.2.X)', np.float64(0.530893713597322)), ('BA.2.86* (BA.2.86.X)', np.float64(0.32573548579853917)), ('LB.1* (LB.1.X)', np.float64(0.11832101334539023)), ('KP.3* (KP.3.X)', np.float64(0.024846391607010247)), ('Other', np.float64(0.00010783074899675363)), ('JN.1.7* (JN.1.7.X)', np.float64(9.604488679340085e-05)), ('Omicron', np.float64(1.5196053542664502e-07)), ('Delta', np.float64(9.330734320629052e-08)), ('XBB.1.5* [Omicron (XBB.1.5.X)]', np.float64(8.689417946710268e-08)), ('XBB.1.16* [Omicron (XBB.1.16.X)]', np.float64(2.306572327452938e-08)), ('BA.2.75* [Omicron (BA.2.75.X)]', np.float64(2.192838569416094e-08)), ('XBB* (XBB.X)', np.float64(1.3654405547135934e-08)), ('EG.5* [Omicron (EG.5.X)]', np.float64(1.1991552420024774e-08)), ('XBB.1.9.1* [Omicron (XBB.1.9.1.X)]', np.float64(1.068893678940455e-08)), ('JN.1.18* (JN.1.18.X)', np.float64(1.0287857029669994e-08))]	KP.2 JN.1.16.1 LB.1.3 KP.2.3.3 KP.2.3.2 KP.1.1 KP.1.1.3 KP.3.3 KP.3.2 KR.1.1 JN.1.1.6 KP.4.2.1 KP.2.10 KP.1.1.5 KP.3.2.2 LM.1 KQ.1 JN.1.4.4 JN.1.26 KP.2.16 KP.3.2.3 JN.1.49.1 JN.1.3 XDP.3 JN.1.7.4 JN.1.48.2 KR.1.2 B.1.334 B.1.146 B.1.280 KM.1 EE.1 AY.21 B.1.408 BA.2.9.1 B.1.177.34 XDP B.1.36.19 KP.2.2 KU.2 B.1.448 LW.1 XBB.1.16.16 BL.5 B.53 KP.2.5 XDN KP.2.7 LB.1 XBB.1.19.2 BA.4.1.10 AY.73 HK.23 FL.1.5 LQ.1 BE.9	0.46077487 0.26641229 0.11832100 0.03456765 0.03456645 0.03252255 0.01736550 0.01303540 0.01105528 0.00304871 0.00234615 0.00170792 0.00077055 0.00075384 0.00056095 0.00044189 0.00028413 0.00027865 0.00027601 0.00021413 0.00019474 0.00011699 0.00010735 0.00010697 0.00009604 0.00006299 0.00001049 0.00000036 0.00000015 0.00000010 0.00000009 0.00000008 0.00000008 0.00000006 0.00000005 0.00000005 0.00000004 0.00000004 0.00000003 0.00000003 0.00000003 0.00000002 0.00000002 0.00000002 0.00000002 0.00000002 0.00000002 0.00000001 0.00000001 0.00000001 0.00000001 0.00000001 0.00000001 0.00000001 0.00000001 0.00000001	3.3148671053832164	90.70661806507708
07_15_24_PLJUL10_R1__E0000000__X00__240718_SG_WW__001.tsv	[('KP.2* (KP.2.X)', np.float64(0.5677399822616953)), ('KP.3.1.1* (KP.3.1.1.X)', np.float64(0.16886599928491888)), ('LB.1* (LB.1.X)', np.float64(0.12425999538927028)), ('KP.3* (KP.3.X)', np.float64(0.11166499787228067)), ('BA.2.86* (BA.2.86.X)', np.float64(0.027427822660454678)), ('Other', np.float64(4.1249736083558605e-05)), ('Omicron', np.float64(1.2668860017521607e-08))]	KP.2 KP.3.1.1 LB.1.3 KP.3.3 KP.2.3.2 KP.2.3.3 KP.3.2.3 JN.1.26 JN.1.4.4 KQ.1 JN.1.48 LE.1.3.1 JN.1.49.1 JN.3.2.1 KP.2.16 BA.2.86.3 XDQ BA.2.86.7 B.1.177.34 BQ.1.1.59 B.1.516	0.41038080 0.16886600 0.12426000 0.08816630 0.07856200 0.07856200 0.02349870 0.01465103 0.00647923 0.00343965 0.00127065 0.00059702 0.00038543 0.00034350 0.00023518 0.00022901 0.00004117 0.00003232 0.00000007 0.00000001 0.00000001	3.943350899321458	91.31859679630806
07_15_24_PLJUL07_R1__E0000000__X00__240718_SG_WW__001.tsv	[('BA.2.86* (BA.2.86.X)', np.float64(0.5815750736712768)), ('KP.2* (KP.2.X)', np.float64(0.19336440696800314)), ('KP.3* (KP.3.X)', np.float64(0.13880712438391207)), ('LB.1* (LB.1.X)', np.float64(0.08458575848264997)), ('KP.3.1.1* (KP.3.1.1.X)', np.float64(0.001435912518168748)), ('Other', np.float64(0.0002321021916517886)), ('Omicron', np.float64(1.134854532972821e-07)), ('XBB.1.5* [Omicron (XBB.1.5.X)]', np.float64(3.929505609177286e-08)), ('BA.2.75* [Omicron (BA.2.75.X)]', np.float64(2.2944996087512185e-08)), ('CH.1.1* [Omicron (CH.1.1.X)]', np.float64(1.2576899493058196e-08)), ('Gamma', np.float64(1.1296569952532686e-08)), ('A', np.float64(1.1229662155779305e-08)), ('Delta', np.float64(1.093241752781928e-08)), ('EG.5* [Omicron (EG.5.X)]', np.float64(1.009097805841355e-08))]	KP.1.1 KP.1 KP.1.2 KP.3.3 KP.2.3.2 KP.2.3.3 LB.1.1 KP.2.5 KP.2 JN.1.11.1 KP.5 LB.1.3 LW.1 KP.3.2.3 LP.1 JN.1.42.2 JN.1.42 KP.3.1.4 KP.2.9 KP.3.1.1 KY.1 XDK.4 LE.1.2 LF.3 JN.1.55 JN.3.2.1 LE.1 JN.1.4.7 JN.1.4.4 JN.1.4 KQ.1 JN.1.4.3 B.1.177.39 B.1.36.33 KP.2.2 B.1.328 EE.1 KP.3.1 JN.1.2.1 XBB.1.5.106 BF.36 FR.1.3 JN.1.2 BA.2.66 KM.1 B.1.177.34 BA.2.68 CH.1.1.26 P.1.17 A.2.5 AY.4.17 EG.5.1.12	0.19158147 0.17023511 0.10403310 0.08904579 0.05504600 0.05504600 0.05444499 0.04030405 0.04030405 0.03926747 0.03424203 0.03014077 0.02240540 0.02240540 0.01729633 0.01142683 0.01134201 0.00495050 0.00266414 0.00143591 0.00125892 0.00023164 0.00021322 0.00015122 0.00015107 0.00013267 0.00008570 0.00008570 0.00001805 0.00001805 0.00001805 0.00001805 0.00000021 0.00000016 0.00000016 0.00000008 0.00000006 0.00000003 0.00000003 0.00000002 0.00000002 0.00000002 0.00000002 0.00000002 0.00000001 0.00000001 0.00000001 0.00000001 0.00000001 0.00000001 0.00000001 0.00000001	3.420476444195229	91.92723138146674
07_15_24_PLJUL08_R2__E0000000__X00__240718_SG_WW__001.tsv	[('BA.2.86* (BA.2.86.X)', np.float64(0.4151508776830741)), ('KP.3.1.1* (KP.3.1.1.X)', np.float64(0.2254699969245525)), ('KP.2* (KP.2.X)', np.float64(0.19454092917447854)), ('KP.3* (KP.3.X)', np.float64(0.16436099256905343)), ('Other', np.float64(0.0003452303777152026)), ('JN.1.18* (JN.1.18.X)', np.float64(0.00013212827378500738)), ('EG.5* [Omicron (EG.5.X)]', np.float64(6.169186898204452e-08)), ('Delta', np.float64(4.6520831304270546e-08)), ('Omicron', np.float64(4.331698350803437e-08)), ('LB.1* (LB.1.X)', np.float64(3.415801002410264e-08)), ('XBB.1.5* [Omicron (XBB.1.5.X)]', np.float64(2.045633579622469e-08)), ('BA.2.75* [Omicron (BA.2.75.X)]', np.float64(1.9216331557451194e-08))]	KP.3.1.1 LF.3 KP.1.1.3 KP.1 KP.2.3.2 KP.2.3.3 KP.3.3 KP.3 JN.1.9 JN.1.49.2 KP.2.3 KP.1.1.1 KP.3.1 JN.1.4 LL.1 KP.2.4 JN.1.11.1 KP.2.8 KP.2.15 JN.1.8.2 KP.2.2 BA.2.86.1 KP.3.2.3 JN.1.55 JN.1.27 KR.1.1 LE.1.2 JN.1.48.2 JN.5 JN.1.8.3 JN.1.3 LQ.3 XDK.1 XDQ.1.1 JN.3.2.1 XDV JN.1.19 JN.5.1 KP.3.2.4 B.1.177.34 B.1.22.1 JN.1.53.1 HK.25 AY.3.4 LB.1.3 XDK.4 GK.1.10 FR.1.3 B.1.544 EE.1 JN.1.22 BE.1.4.3 BF.11.3 JN.1.18.5	0.22547000 0.07864685 0.07739100 0.07414479 0.06961800 0.06961800 0.06761590 0.06209864 0.05861656 0.04878598 0.04281099 0.03516520 0.03434500 0.01970198 0.01233500 0.01060348 0.00786705 0.00089409 0.00062099 0.00053134 0.00037538 0.00025042 0.00024510 0.00023910 0.00022562 0.00019110 0.00018290 0.00017704 0.00017593 0.00013645 0.00013253 0.00013212 0.00012709 0.00012319 0.00011478 0.00009456 0.00007742 0.00006175 0.00005636 0.00000021 0.00000015 0.00000008 0.00000006 0.00000005 0.00000003 0.00000002 0.00000002 0.00000002 0.00000002 0.00000002 0.00000002 0.00000001 0.00000001 0.00000001	6.7512906671901565	95.5088118249005
07_15_24_PLJUL09_R1__E0000000__X00__240718_SG_WW__001.tsv	[('BA.2.86* (BA.2.86.X)', np.float64(0.4851113477772426)), ('KP.3* (KP.3.X)', np.float64(0.26598098426025174)), ('KP.2* (KP.2.X)', np.float64(0.1811640951959735)), ('KP.3.1.1* (KP.3.1.1.X)', np.float64(0.06735199198356924)), ('JN.1.7* (JN.1.7.X)', np.float64(0.00039115690257454785)), ('Other', np.float64(1.0808980993493853e-06)), ('Omicron', np.float64(4.138955147933425e-07)), ('XBB.1.5* [Omicron (XBB.1.5.X)]', np.float64(1.1405908912885217e-07)), ('XBB* (XBB.X)', np.float64(1.0872375830786528e-07)), ('XBB.1.9.2* [Omicron (XBB.1.9.2.X)]', np.float64(5.4678221810594406e-08)), ('XBB.1.16* [Omicron (XBB.1.16.X)]', np.float64(5.3831499539428444e-08)), ('CH.1.1* [Omicron (CH.1.1.X)]', np.float64(4.1053309723302914e-08)), ('Delta', np.float64(4.091761224771434e-08)), ('XBB.2.3* (XBB.2.3X)', np.float64(2.5839364386777304e-08)), ('Gamma', np.float64(1.718280198881034e-08)), ('XBB.1.9.1* [Omicron (XBB.1.9.1.X)]', np.float64(1.4767215884497307e-08)), ('LB.1* (LB.1.X)', np.float64(1.2974826856234421e-08))]	JN.1.11.1 JN.1.52 KP.3 KP.3.3 KP.2.3.3 KP.2.3.2 KP.3.1.1 JN.1.13 KP.3.2 KP.1 JN.1.58.1 KP.3.1.3 KP.3.1 KP.5 KP.1.2 KP.2.15 KP.2.2 JN.1.39.3 KP.1.1.4 JN.1.4.8 JN.1.7.4 LM.1 KR.1.1 KP.2.9 JN.3.2.1 B.1.611 LL.1 JN.1.7.6 XDQ BA.5.2.35 EE.1 XBB.1.19.2 HP.1.1 JN.1.19 JN.1.4 JN.1.4.3 B.1.36.33 EG.1.5 XBB.1.16.16 B.1.334 CH.1.1.14 CP.7 N.5 BA.2.9.1 BA.4.3 B.1.1.449 XCV GK.1.10 XAU BA.2.9.3 XDQ.1.1 AY.92 AY.70 XCZ P.1.17 B.1.177.87 XDS B.1.496 FL.37 B.1.591 BA.5.2.14 HH.7 LB.1.3 BE.4.2 GJ.1.2.3 C.2.1 XBB.1.5.50 XBB.7 KP.3.2.2 KP.4.2.2	0.24873934 0.13886499 0.12011869 0.10581700 0.08879216 0.08879183 0.06735199 0.04627680 0.02895108 0.01967621 0.01913880 0.00554710 0.00554710 0.00551197 0.00438169 0.00267237 0.00076512 0.00071632 0.00067159 0.00053031 0.00039090 0.00031294 0.00019942 0.00014261 0.00009046 0.00000061 0.00000030 0.00000026 0.00000017 0.00000013 0.00000012 0.00000010 0.00000008 0.00000008 0.00000007 0.00000007 0.00000007 0.00000005 0.00000005 0.00000004 0.00000004 0.00000003 0.00000003 0.00000003 0.00000003 0.00000002 0.00000002 0.00000002 0.00000002 0.00000002 0.00000002 0.00000002 0.00000002 0.00000002 0.00000002 0.00000002 0.00000002 0.00000002 0.00000001 0.00000001 0.00000001 0.00000001 0.00000001 0.00000001 0.00000001 0.00000001 0.00000001 0.00000001 0.00000001 0.00000001	4.141983073983025	92.21817208975688
07_15_24_SBJUL11_R1__E0000000__X00__240718_SG_WW__001.tsv	[('KP.2* (KP.2.X)', np.float64(0.5069770564906256)), ('BA.2.86* (BA.2.86.X)', np.float64(0.2521310543126149)), ('KP.3.1.1* (KP.3.1.1.X)', np.float64(0.19217000185106164)), ('JN.1.7* (JN.1.7.X)', np.float64(0.03715760891072113)), ('KP.3* (KP.3.X)', np.float64(0.011363601380601275)), ('Other', np.float64(0.00020078232028946576)), ('XBB.1.16* [Omicron (XBB.1.16.X)]', np.float64(9.638908044445783e-08)), ('Omicron', np.float64(8.617942262809946e-08)), ('Delta', np.float64(5.6980062345271644e-08))]	KP.2 KP.3.1.1 KP.1.1 KP.5 KP.1.2 KP.2.3.2 KP.2.3.3 JN.1.7.3 KP.3.3 KP.1.1.3 JN.1.4.8 JN.1.2.1 KP.1.1.4 LE.1 JN.1.27 KQ.1 JN.1.49.1 XEB KP.2.9 KP.2.8 JN.1.26 JN.1.3 B.1.36.33 GY.8 AY.3.4 XDQ XDS BF.5.4 BA.2.82 EE.1 CY.2 B.1.563 B.3.1	0.42861017 0.19217000 0.12919645 0.06333519 0.04719415 0.03905965 0.03905964 0.03715761 0.01136360 0.00916325 0.00062696 0.00060570 0.00060014 0.00047687 0.00040883 0.00030395 0.00020482 0.00020047 0.00017008 0.00007751 0.00001445 0.00000030 0.00000019 0.00000010 0.00000006 0.00000005 0.00000004 0.00000003 0.00000002 0.00000002 0.00000002 0.00000002 0.00000001	5.011006759807093	93.15787713607331
07_15_24_ENCJUL09_R2__E0000000__X00__240718_SG_WW__001.tsv	[('BA.2.86* (BA.2.86.X)', np.float64(0.5363374349996314)), ('KP.2* (KP.2.X)', np.float64(0.25917988174452133)), ('KP.3* (KP.3.X)', np.float64(0.1686274824719393)), ('LB.1* (LB.1.X)', np.float64(0.03550886492363273)), ('KP.3.1.1* (KP.3.1.1.X)', np.float64(0.0002116179188158327)), ('Other', np.float64(0.0001346891515524681)), ('A', np.float64(9.163233436960311e-08)), ('Delta', np.float64(3.325433472110492e-08)), ('Omicron', np.float64(2.932324811611989e-08)), ('XBB.1.9.1* [Omicron (XBB.1.9.1.X)]', np.float64(1.2128343110163078e-08))]	KP.1.1 KP.2.3 KP.3.3 KP.2.2 KP.1.1.5 KP.1.1.1 LB.1.1 KP.2.3.2 KP.2.3.3 KP.3.1 LB.1.4 JN.1.4.4 LR.2 KP.3.1.4 KR.1.1 KP.2.15 KP.2.8 LM.1 LF.3 KP.3.1.1 JN.1.5 KP.3.2.3 LE.1.1 XDP.3 KP.2.16 KP.3.1.2 JN.3.2.1 A.11 AY.3.4 EE.1 B.1.177.34 FL.1.2 BA.2.76.2 JN.1.49.1	0.46437280 0.19085920 0.15472400 0.04287760 0.03094780 0.02959040 0.02484800 0.01191490 0.01191490 0.01177551 0.01066087 0.00651176 0.00254776 0.00189753 0.00142046 0.00111607 0.00042983 0.00037489 0.00021176 0.00021162 0.00019212 0.00018877 0.00016650 0.00013467 0.00006739 0.00004167 0.00000117 0.00000009 0.00000003 0.00000002 0.00000002 0.00000001 0.00000001 0.00000001	7.090215847355854	95.31485135270708
07_15_24_ENCJUL10_R1__E0000000__X00__240718_SG_WW__001.tsv	[('KP.2* (KP.2.X)', np.float64(0.4452469387772935)), ('KP.3.1.1* (KP.3.1.1.X)', np.float64(0.3809519996511324)), ('BA.2.86* (BA.2.86.X)', np.float64(0.14420808668804996)), ('LB.1* (LB.1.X)', np.float64(0.029112099979625643)), ('JN.1.7* (JN.1.7.X)', np.float64(0.00044916868927978733)), ('Other', np.float64(3.1715703603638674e-05))]	KP.3.1.1 KP.2.15 KP.2.3 KP.1 JN.1.4 LB.1.3 JN.1.26 KP.2.3.3 KP.2.3.2 KP.1.1.5 JN.1.16 JN.1.6 KP.2.2 KP.1.1.1 JN.1.2 KP.2.6 KS.1 JN.1.7.4 BA.2.86 BA.2.86.2 JN.1.3 JN.1.49 LE.1.2 JN.1.48.1 JN.1.19 XDP.3 B.1.438.4	0.38095200 0.32120213 0.08982240 0.06335611 0.04898829 0.02911210 0.01782969 0.01587530 0.01587530 0.00633994 0.00232711 0.00205761 0.00185300 0.00078401 0.00075244 0.00061881 0.00045438 0.00044917 0.00028850 0.00028850 0.00025054 0.00018066 0.00012842 0.00010451 0.00007737 0.00003169 0.00000003	4.607152437653391	90.59291709861887
