	summarized	lineages	abundances	resid	coverage
06_03_24_PLMAY27_R2__E0000000__X00__240624_2_SG_WW__001.tsv	[('BA.2.86* (BA.2.86.X)', np.float64(0.5989911721215325)), ('KP.2* (KP.2.X)', np.float64(0.31419275940771507)), ('JN.1.7* (JN.1.7.X)', np.float64(0.08089889990929255)), ('KP.3* (KP.3.X)', np.float64(0.0059171593444030095))]	KP.2.3 JN.1.39 JN.1.42.2 JN.1.42 JN.1.7.1 JN.1.7 JN.1.7.3 KP.1.1.1 JN.1.36 KP.2.5 JN.1.11.1 KP.2 KP.3.3 JN.1.63 JN.1.43.1 JN.16 JN.1.52 KY.1 JN.1.54 KP.2.2 KP.2.3.2 KP.2.3.3 JN.1.38 JN.1.25.1 JN.1.25 JN.1.39.3 JN.1.7.6 KP.2.9 JN.1.27 LF.3.1 JN.1.4.4 JN.1.4 JN.1.55 JN.1.8.2 JN.1.49.1 JN.1.49 JN.1.53.1 JN.1.48.2	0.30020332 0.19759750 0.17642452 0.17642309 0.02689440 0.02689440 0.02689440 0.02450820 0.00657111 0.00633881 0.00633881 0.00633881 0.00591716 0.00289855 0.00202429 0.00193800 0.00093197 0.00084531 0.00046620 0.00043131 0.00034284 0.00034284 0.00033036 0.00025530 0.00025530 0.00021650 0.00021570 0.00019482 0.00019275 0.00016039 0.00011280 0.00011280 0.00009049 0.00007805 0.00006370 0.00006370 0.00005371 0.00003779	6.952324566671553	93.8501153730395
06_03_24_PLMAY26_R1__E0000000__X00__240624_2_SG_WW__001.tsv	[('BA.2.86* (BA.2.86.X)', np.float64(0.9143322669019185)), ('KP.2* (KP.2.X)', np.float64(0.0750850339265333)), ('KP.3* (KP.3.X)', np.float64(0.010097322559968563)), ('Other', np.float64(0.0004816587701704709)), ('KP.3.1.1* (KP.3.1.1.X)', np.float64(5.589803033397965e-06)), ('A', np.float64(3.4977774086856338e-06)), ('Omicron', np.float64(2.4602436274534533e-06)), ('XBB.1.5* [Omicron (XBB.1.5.X)]', np.float64(1.3833664808403508e-06)), ('XBB.1.9.1* [Omicron (XBB.1.9.1.X)]', np.float64(2.8760095642434623e-07)), ('XBB.2.3* (XBB.2.3X)', np.float64(2.1595437963564947e-07)), ('Delta', np.float64(1.9907353955386454e-07)), ('XBB* (XBB.X)', np.float64(1.7877709088069594e-07)), ('XBB.1.16* [Omicron (XBB.1.16.X)]', np.float64(1.308858693494196e-07)), ('CH.1.1* [Omicron (CH.1.1.X)]', np.float64(1.1039918495569314e-07)), ('LB.1* (LB.1.X)', np.float64(1.1015831762543974e-07)), ('BA.2.75* [Omicron (BA.2.75.X)]', np.float64(6.4241007311842e-08)), ('Gamma', np.float64(2.05283540502234e-08)), ('JN.1.7* (JN.1.7.X)', np.float64(1.981670031279385e-08)), ('Theta', np.float64(1.716609159702718e-08)), ('XBB.1.9.2* [Omicron (XBB.1.9.2.X)]', np.float64(1.477277174519081e-08)), ('Eta', np.float64(1.3473817339587976e-08)), ('EG.5* [Omicron (EG.5.X)]', np.float64(1.1817960151897809e-08)), ('JN.1.18* (JN.1.18.X)', np.float64(1.0670982267947849e-08))]	JN.1.16.1 JN.1.16 KP.2.7 JN.1.34 KP.3.2 KP.3.2.1 JN.1.38 JN.1.8.2 JN.1.46 JN.1.55.2 JN.1.6.1 JN.1.6 KP.2.15 KP.3.2.2 JN.1.19 LM.1 JN.3.2.1 JN.1.29.1 JN.1.47.2 KP.1.1 KP.1 JN.1.5 JN.2.1 KP.1.1.3 LF.1.1 XEB JN.17 LN.1.1 LF.3 XDK.4 KP.1.1.1 KP.2.9 JN.19 KP.2.11 BA.2.86.6 LV.2 JN.1.54 XDQ JN.5.1 JN.1.4.4 JN.1.4 KP.2.16 KP.3.2.3 XDR JN.1.48.2 BA.2.86.1 KR.1.1 XDP.1 JN.9 KP.3.1.1 A.2 LF.1 GK.1.10 B.1.36.33 XR CP.7 EV.1 XAW XCV XDK.4.1 KN.1.1 XDS XDV XBF.8 B.1.637.1 B.1.177.34 FL.1.7 LE.2 JN.1.56 BE.13 AY.40 A.21 KP.1.1.4 XDD.1.1.1 XDD.1.1 KP.2.2 GS.6 A.22 LB.1.7 JN.2.4 JN.1.55 KH.1 B.1.177.26 KE.3 XCZ B.58 FL.31.1 B.1.438.4 A.2.5.3 CH.1.1.24 BA.1.15 CM.8.1.5 XDR.1 JN.1.8.4 KP.2.12 JN.1.28.1 A.27 AY.73 KP.2.14 JM.1 JN.1.23 B.1.258.23 XBB.1.16.24 HE.1 JN.1.48.1 KP.2 JN.1.11.1 JN.2 XDK.5 JN.1.43.1 FK.1.2.2 A.2.3 B.1.616 KP.3.3 JN.1.54.1 XBJ.1.1 GE.1.1 JN.1.27 JN.1.57 JN.1.31 DB.1 XDZ KZ.1.1 KZ.1 XCW JN.1.8.3 BA.2.83 GA.4.1.3 XDP.2 LE.1.2 XBC.1.1.2 B.1.177.39 B.1.630 CP.8.1 KP.2.3.3 CK.2.1.1 B.1.258.15 XCN FB.2 JN.1.25.1 JN.1.25 LU.1 JN.1.15.1 KP.3.1.2 BF.7.4.2 JN.1.39.1 JN.14 BL.5 P.1.3 KP.2.3.2 GY.8 JN.1.7.4 FL.1.8 JF.3 LL.1 JN.7 HR.1 FR.1.3 LB.1 BF.7.5.1 AV.1 DB.3 P.3 JC.5.1 BA.1.15.3 XDK.2 LR.1 XCS JN.2.3 BA.4.1.7 JN.1.39.3 AU.3 GL.2 B.1.631 FL.10.2 LE.1.3.1 KY.1 JN.1.4.1 JW.1.1 AY.33.1 LW.1 CM.7.1.1 JN.1.55.1 KP.2.5 B.1.160.20 KP.1.1.2 XBB.1.34.1 KG.2 DB.2 EG.2.1 BF.5.3 B.1.641 XDQ.2 BA.5.12 XCM B.1.160.9 B.1.640.2 BA.5.2.39 LV.1 HW.1.3 XDU JB.1.1 HR.1.1 FR.1.1 HN.4.1.1 LF.1.1.1 B.1.525 JP.1.1 XAY.1.2 A.30 XBT XDK.3 AY.28 BA.1.16.1 XBR GE.1.6 BF.5.2 LF.2 BA.2.87.1 JN.1.2.1 XCH.1 KP.3.1.3 XDK.1.2 GS.7.1 LB.1.4 HU.2 HK.13.2.1 JD.1.2.1 EW.1 FP.2.1.2 B.1.619.1 AY.120.2.1 W.1 JN.16 FU.5 EJ.3 XBB.2.3.21 CH.1.1.18 HH.8.1 XBB.1.16.27 KP.3.2.4 LG.1 XDK.6 LP.1 JN.1.18.2 DF.1.1 DN.1.1.3 B.1.575.2 BA.2.86.7 JN.1.51.1 JN.1.4.5 KP.4.2.2 KP.2.6	0.52208979 0.37534883 0.07442728 0.00879379 0.00810631 0.00156128 0.00110184 0.00077923 0.00075813 0.00060659 0.00054356 0.00054334 0.00037484 0.00035428 0.00033167 0.00025319 0.00023479 0.00022408 0.00020926 0.00018856 0.00018854 0.00018847 0.00018468 0.00018172 0.00017540 0.00015981 0.00015953 0.00014904 0.00013969 0.00012002 0.00010827 0.00010387 0.00010288 0.00010284 0.00010116 0.00010066 0.00008974 0.00008916 0.00008760 0.00008019 0.00008019 0.00007593 0.00007537 0.00007464 0.00007340 0.00006233 0.00004955 0.00003371 0.00001978 0.00000559 0.00000317 0.00000136 0.00000096 0.00000082 0.00000060 0.00000048 0.00000045 0.00000045 0.00000043 0.00000038 0.00000036 0.00000035 0.00000032 0.00000031 0.00000029 0.00000025 0.00000019 0.00000016 0.00000015 0.00000013 0.00000012 0.00000012 0.00000011 0.00000010 0.00000010 0.00000009 0.00000009 0.00000009 0.00000008 0.00000008 0.00000006 0.00000005 0.00000005 0.00000005 0.00000005 0.00000005 0.00000004 0.00000004 0.00000004 0.00000004 0.00000004 0.00000004 0.00000004 0.00000004 0.00000004 0.00000004 0.00000004 0.00000004 0.00000004 0.00000003 0.00000003 0.00000003 0.00000003 0.00000003 0.00000003 0.00000003 0.00000003 0.00000003 0.00000003 0.00000003 0.00000003 0.00000003 0.00000003 0.00000003 0.00000003 0.00000003 0.00000003 0.00000003 0.00000003 0.00000003 0.00000003 0.00000003 0.00000003 0.00000003 0.00000002 0.00000002 0.00000002 0.00000002 0.00000002 0.00000002 0.00000002 0.00000002 0.00000002 0.00000002 0.00000002 0.00000002 0.00000002 0.00000002 0.00000002 0.00000002 0.00000002 0.00000002 0.00000002 0.00000002 0.00000002 0.00000002 0.00000002 0.00000002 0.00000002 0.00000002 0.00000002 0.00000002 0.00000002 0.00000002 0.00000002 0.00000002 0.00000002 0.00000002 0.00000002 0.00000002 0.00000002 0.00000002 0.00000002 0.00000002 0.00000002 0.00000002 0.00000002 0.00000002 0.00000002 0.00000002 0.00000002 0.00000002 0.00000002 0.00000002 0.00000002 0.00000002 0.00000002 0.00000002 0.00000002 0.00000002 0.00000002 0.00000002 0.00000002 0.00000002 0.00000002 0.00000002 0.00000002 0.00000001 0.00000001 0.00000001 0.00000001 0.00000001 0.00000001 0.00000001 0.00000001 0.00000001 0.00000001 0.00000001 0.00000001 0.00000001 0.00000001 0.00000001 0.00000001 0.00000001 0.00000001 0.00000001 0.00000001 0.00000001 0.00000001 0.00000001 0.00000001 0.00000001 0.00000001 0.00000001 0.00000001 0.00000001 0.00000001 0.00000001 0.00000001 0.00000001 0.00000001 0.00000001 0.00000001 0.00000001 0.00000001 0.00000001 0.00000001 0.00000001 0.00000001 0.00000001 0.00000001 0.00000001 0.00000001 0.00000001 0.00000001 0.00000001 0.00000001 0.00000001 0.00000001 0.00000001 0.00000001 0.00000001 0.00000001 0.00000001 0.00000001 0.00000001 0.00000001 0.00000001 0.00000001 0.00000001 0.00000001 0.00000001 0.00000001	8.883139821505951	95.15767648730896
06_03_24_PLMAY29_R2__E0000000__X00__240624_2_SG_WW__001.tsv	[('BA.2.86* (BA.2.86.X)', np.float64(0.8518899491686464)), ('KP.3* (KP.3.X)', np.float64(0.14638675024356157)), ('KP.2* (KP.2.X)', np.float64(0.000864916316365272)), ('Other', np.float64(0.0004497347661648985)), ('Omicron', np.float64(0.0004115928708362012)), ('XBB.1.16* [Omicron (XBB.1.16.X)]', np.float64(1.2391280333213678e-06)), ('Delta', np.float64(2.847333431972532e-07)), ('JN.1.7* (JN.1.7.X)', np.float64(1.0315461139225547e-07)), ('CH.1.1* [Omicron (CH.1.1.X)]', np.float64(9.542812119405775e-08)), ('EG.5* [Omicron (EG.5.X)]', np.float64(6.931521877868724e-08)), ('Iota', np.float64(5.672378686008518e-08)), ('BA.2.75* [Omicron (BA.2.75.X)]', np.float64(5.563149388172967e-08)), ('XBB.2.3* (XBB.2.3X)', np.float64(2.6605824422547968e-08)), ('XBB* (XBB.X)', np.float64(2.6444724937629025e-08)), ('XBB.1.9.1* [Omicron (XBB.1.9.1.X)]', np.float64(1.4893944099525828e-08)), ('A', np.float64(1.3182446111085595e-08)), ('XBB.1.9.2* [Omicron (XBB.1.9.2.X)]', np.float64(1.1819188302847864e-08))]	KP.5 KQ.1 KP.3.1 JN.1.11 KP.1.2 LL.1 JN.1.4.8 KP.2.15 KR.1 JN.1.53.1 LE.1 JQ.2 XDK.4 BA.2.38.3 XEB BG.2 KP.3.2.4 JN.1.49.2 JN.3.2.1 LF.3 KP.2.3.2 KP.2.3.3 KP.2.16 B.1.177.34 GY.8 B.1.516 BA.2.74 AY.78 EE.1 BE.8 B.1.593 JN.1.7.6 B.1.526 FB.2 AY.73 B.1.622 CH.1.1.4 LN.1.1 B.1.36.33 CP.7 B.1.488 KG.2 LM.1 KP.2.3.1 HK.16 GJ.1.2.2 HE.1 KP.3.1.3 B.1.476 XBC.2.1 BA.2.68 AY.40 KP.3.2 JN.1.4.3 JN.1.4.7 BF.7.4.1 CR.1.2 BF.7.27 BE.4.2 B.53 KP.2.12 XD XDP.3 BQ.1.1.59 JN.1.57.1 HK.3.10 BR.4 KR.1.2 BE.3 FK.1.3.2 KP.2.2 BF.11.3 FL.18.1.1 BR.2.1 B.1.408 B.1.640.2 AA.5 EJ.3 CM.4.1 B.1.563 HK.3.3 B.1.9.4 XDK.4.1 B.1.2 A.2.4 B.1.619.1 KZ.1.1.1 XAW B.1.160.21 LE.1.3.1 XDQ.2 EG.1.8 LD.1 B.6.2 BQ.1.1.35 KP.3.3 BA.2.82 XDS JN.2.2.1 B.1.611 HK.13.2.1 AY.43.1 BE.9 KP.2.8 BN.1.3.11 BA.2.3.15 BA.1.20 B.35	0.40907720 0.27262331 0.14626695 0.14032211 0.01886786 0.00675672 0.00249067 0.00064061 0.00047156 0.00039246 0.00030212 0.00027986 0.00025142 0.00023218 0.00019563 0.00017860 0.00011974 0.00011919 0.00009853 0.00008817 0.00008241 0.00008240 0.00005942 0.00000128 0.00000124 0.00000087 0.00000022 0.00000020 0.00000015 0.00000013 0.00000011 0.00000010 0.00000006 0.00000006 0.00000006 0.00000005 0.00000005 0.00000005 0.00000004 0.00000004 0.00000003 0.00000003 0.00000003 0.00000003 0.00000003 0.00000003 0.00000003 0.00000003 0.00000002 0.00000002 0.00000002 0.00000002 0.00000002 0.00000002 0.00000002 0.00000002 0.00000002 0.00000002 0.00000002 0.00000002 0.00000002 0.00000002 0.00000002 0.00000002 0.00000002 0.00000002 0.00000002 0.00000002 0.00000002 0.00000002 0.00000002 0.00000002 0.00000001 0.00000001 0.00000001 0.00000001 0.00000001 0.00000001 0.00000001 0.00000001 0.00000001 0.00000001 0.00000001 0.00000001 0.00000001 0.00000001 0.00000001 0.00000001 0.00000001 0.00000001 0.00000001 0.00000001 0.00000001 0.00000001 0.00000001 0.00000001 0.00000001 0.00000001 0.00000001 0.00000001 0.00000001 0.00000001 0.00000001 0.00000001 0.00000001 0.00000001 0.00000001 0.00000001	7.998494091886741	92.47232719125171
06_03_24_SBMAY28_R2__E0000000__X00__240624_2_SG_WW__001.tsv	[('BA.2.86* (BA.2.86.X)', np.float64(0.5302672935394309)), ('JN.1.7* (JN.1.7.X)', np.float64(0.4079319940720353)), ('KP.2* (KP.2.X)', np.float64(0.06114892805687402)), ('KP.3* (KP.3.X)', np.float64(0.0003662511239189516)), ('Other', np.float64(0.00022250163777882086)), ('XBB* (XBB.X)', np.float64(5.104207056506612e-05)), ('Omicron', np.float64(1.2213853015852318e-05)), ('XBB.1.5* [Omicron (XBB.1.5.X)]', np.float64(8.605541982413095e-08)), ('BA.2.75* [Omicron (BA.2.75.X)]', np.float64(3.6019610287306226e-08)), ('EG.5* [Omicron (EG.5.X)]', np.float64(2.1269344978697546e-08)), ('CH.1.1* [Omicron (CH.1.1.X)]', np.float64(1.8969780435214343e-08))]	JN.1.7 KP.5 JN.1.4.3 KP.2.2 JN.1.4.6 KR.1.1 JN.1.11 JN.1.7.3 KQ.1 JN.1.1.1 JN.1.4.5 KP.2.15 KP.1.1.2 KP.3.2.3 JN.1.1.9 JN.1.17 JN.1.27 KP.2.9 LV.1 JN.1.19 JN.1.47.1 LE.1.1 KP.2.10 JN.1.29 KP.2.16 KP.2.3.3 KP.2.3.2 JN.3.2.1 JN.1.14 KP.4.2.2 JN.1.5 XDQ.2 XDZ JN.5.1 XBA XAW FP.2.1.2 BA.2.86.1 JN.2.2.1 XCZ BA.4.3 XBB.1.20 N.10 GK.1.10 JN.1.3 EV.1 FR.1.3 B.1.177.34 KV.2 JR.1 JN.1.39.3 CH.1.1.26 DY.3 KP.1.1.1 BA.5.1.32 JC.5.1 BW.1.1	0.39381164 0.26622444 0.12549958 0.06002388 0.05703605 0.03374320 0.02574101 0.01412036 0.01311453 0.00393392 0.00258062 0.00040277 0.00039651 0.00036625 0.00026699 0.00024349 0.00023838 0.00020915 0.00017194 0.00017084 0.00015949 0.00014352 0.00014352 0.00012608 0.00012434 0.00012264 0.00012264 0.00011548 0.00010765 0.00007180 0.00006590 0.00006079 0.00005858 0.00004954 0.00004500 0.00004074 0.00003914 0.00003592 0.00003031 0.00001705 0.00001213 0.00001189 0.00000030 0.00000009 0.00000004 0.00000004 0.00000004 0.00000003 0.00000002 0.00000002 0.00000002 0.00000002 0.00000002 0.00000001 0.00000001 0.00000001 0.00000001	5.932618184297903	96.41507541049393
06_03_24_ENCMAY28_R1__E0000000__X00__240624_2_SG_WW__001.tsv	[('KP.2* (KP.2.X)', np.float64(0.5281867064472094)), ('BA.2.86* (BA.2.86.X)', np.float64(0.4426819223720425)), ('JN.1.18* (JN.1.18.X)', np.float64(0.02863771993836279)), ('KP.3* (KP.3.X)', np.float64(0.0002586319609994531)), ('Other', np.float64(0.0002350164110942001))]	KP.2.5 KP.2 JN.1.11.1 KP.2.3 JN.1.48 JN.1.9.2 JN.1.8 JN.1 JN.1.9 JN.1.18 JN.1.28 KP.2.3.2 KP.2.3.3 KP.2.10 JN.1.8.2 LE.1.2 JN.1.53.1 KP.2.2 JN.1.3 JN.1.47 JN.1.8.3 JN.1.26 KP.2.15 JN.1.27 JN.1.25.1 JN.1.25 JN.1.43.1 XDQ BA.2.86.2 BA.2.86 JN.1.57 JN.1.29 JN.1.54 LW.1 KP.3.2.3 JN.5 LF.3 B.1.83	0.17647266 0.17647266 0.17647266 0.12097000 0.11550000 0.02863772 0.02863772 0.02863772 0.02863772 0.02863772 0.02863772 0.02569650 0.02569650 0.00217865 0.00193237 0.00100129 0.00087566 0.00039262 0.00037481 0.00037285 0.00037113 0.00036480 0.00030712 0.00030031 0.00028425 0.00028425 0.00024021 0.00023500 0.00023100 0.00023100 0.00021121 0.00015237 0.00013367 0.00012932 0.00012932 0.00010660 0.00005288 0.00000002	3.387896889179371	89.27197940006019
06_03_24_PLMAY28_R2__E0000000__X00__240624_2_SG_WW__001.tsv	[('BA.2.86* (BA.2.86.X)', np.float64(0.9180845141666462)), ('LB.1* (LB.1.X)', np.float64(0.06629185355115538)), ('JN.1.18* (JN.1.18.X)', np.float64(0.010244285705048322)), ('KP.3* (KP.3.X)', np.float64(0.0036316458655707594)), ('KP.2* (KP.2.X)', np.float64(0.0010839397656443543)), ('Other', np.float64(0.00032983044212644416)), ('JN.1.7* (JN.1.7.X)', np.float64(0.0002423522379628791)), ('XBB.1.5* [Omicron (XBB.1.5.X)]', np.float64(5.1212095494280456e-05)), ('XBB.2.3* (XBB.2.3X)', np.float64(4.036857161187436e-05)), ('BA.2.75* [Omicron (BA.2.75.X)]', np.float64(1.7725882762805875e-08)), ('Omicron', np.float64(1.5902731593227224e-08))]	KP.1.1.3 JN.1.11.1 LB.1 JN.1.36 JN.1.18.5 KP.5 KP.3.3 JN.1.4 JN.1.4.3 LB.1.3 JN.1.10 LE.2 JN.1.53 KP.4.1 JN.1.16.2 KP.2.3.1 JN.1.7.6 JN.1.47.1 KP.2.2 LM.1 KP.2.15 JN.1.38 KP.4.1.3 JN.1.8.1 JN.1.54.1 LF.1.1.1 KP.3.2.3 KR.1.1 JN.1.3 JN.1.43.1 JN.1.34 JN.1.21 JN.1.39.3 JN.1.55.1 KV.2 KP.2.9 KW.1.1 LF.3 JN.1.29.1 KP.1.1.2 LB.1.6 JN.1.42.1 JN.1.2.1 JN.1.31 JN.1.41 JN.1.62 JN.1.48.2 KP.2.3.2 JN.1.5 KP.2.16 KP.2.8 KP.1.1.4 KY.1 XAW LB.1.5 XDP.1 KW.1 XEB KP.2.6 GK.1.10 B.1.438.4 JN.1.53.1 XDT KH.1 KU.2 B.1.641 JN.1.48.1 LD.1 JN.1.42 JN.3.2.1 XDQ KP.3.1 KP.3.1.2 B.1.258.16 B.1.544 KP.2.3.3 JN.1.9 JN.1.32.1 FR.1.3 BF.5.3 KN.1.1 LG.1	0.53503321 0.35444642 0.06497696 0.01410657 0.01024429 0.00637306 0.00344333 0.00139759 0.00114995 0.00114745 0.00041083 0.00036756 0.00030684 0.00027950 0.00025987 0.00025805 0.00024235 0.00023584 0.00023305 0.00020760 0.00019678 0.00019433 0.00019142 0.00018856 0.00017219 0.00017184 0.00016398 0.00015594 0.00015490 0.00014633 0.00014544 0.00013835 0.00013558 0.00012244 0.00011940 0.00011674 0.00011379 0.00011183 0.00010909 0.00010893 0.00010704 0.00010553 0.00010196 0.00010004 0.00009279 0.00009235 0.00009061 0.00008782 0.00007696 0.00006936 0.00006893 0.00006685 0.00006162 0.00006144 0.00006040 0.00005849 0.00005555 0.00005511 0.00005271 0.00005120 0.00004690 0.00004404 0.00004368 0.00004037 0.00003703 0.00003112 0.00002903 0.00002890 0.00002365 0.00002233 0.00002007 0.00001257 0.00001176 0.00001062 0.00000240 0.00000050 0.00000002 0.00000002 0.00000002 0.00000002 0.00000002 0.00000001	6.306723117757011	97.662441895462
06_03_24_ENCMAY31_R1__E0000000__X00__240624_2_SG_WW__001.tsv	[('BA.2.86* (BA.2.86.X)', np.float64(0.756368964176908)), ('KP.2* (KP.2.X)', np.float64(0.15014384382641677)), ('KP.3* (KP.3.X)', np.float64(0.09311621897090135)), ('Other', np.float64(0.00023137440482212803)), ('JN.1.7* (JN.1.7.X)', np.float64(0.000139588563902012)), ('XBB.1.16* [Omicron (XBB.1.16.X)]', np.float64(1.1221246455251852e-07)), ('Omicron', np.float64(4.9825149307637664e-08)), ('Delta', np.float64(2.7726047870063496e-08))]	JN.1.35 JN.1.11.1 KP.2.5 KP.3 KP.2 KP.1 KP.1.1 KP.3.3 JN.1.51 JN.1.51.1 JN.1.24 JN.1.24.1 LV.2 JN.1.55 LE.1.2 XDQ.1.1 LF.3 JN.1.48.1 JN.1.3 KP.3.2.4 KP.4.2.2 KP.2.3.3 KP.2.3.1 KP.2.3.2 JN.1.49.1 JN.1.49 JN.1.7.3 JN.1.7 JN.1.7.4 JN.1.7.1 GY.4 B.1.593 BQ.1.1.23 AY.3.4 LE.1 LE.1.1 JN.1.4.7 CN.1 B.27 B.1.177.85	0.62298214 0.07501275 0.07501275 0.07501275 0.07501275 0.02117865 0.02117865 0.01802450 0.00395778 0.00395778 0.00272479 0.00272479 0.00078868 0.00066137 0.00057604 0.00023125 0.00022899 0.00013358 0.00011733 0.00007897 0.00006687 0.00003945 0.00003945 0.00003945 0.00003935 0.00003935 0.00003490 0.00003490 0.00003490 0.00003490 0.00000011 0.00000010 0.00000003 0.00000003 0.00000002 0.00000002 0.00000002 0.00000002 0.00000001 0.00000001	4.817009407937682	84.47647393238137
06_03_24_SBJUN02_R2__E0000000__X00__240624_2_SG_WW__001.tsv	[('BA.2.86* (BA.2.86.X)', np.float64(0.8812533624959654)), ('KP.2* (KP.2.X)', np.float64(0.11098661538971162)), ('JN.1.7* (JN.1.7.X)', np.float64(0.006316967475862559)), ('JN.1.18* (JN.1.18.X)', np.float64(0.0010359852173752338)), ('Omicron', np.float64(0.000291107887643271)), ('XBB* (XBB.X)', np.float64(6.246183792305848e-05)), ('Other', np.float64(5.358806122745832e-05)), ('A', np.float64(2.508005004535389e-08)), ('Delta', np.float64(1.4962293872492878e-08))]	KP.5 KP.1.2 KP.2.4 LF.3.1 LF.3 JN.1.11 JN.1.7.3 KP.2.15 LQ.1 KP.2.3.2 KP.2.3.3 KP.1.1.1 LQ.3 KP.1.1.3 KP.2.16 KW.1 KP.2.9 JN.1.8.3 JN.1.8.1 XAQ XH JN.1.4.8 EV.1 XCZ XBB.1.19.2 JN.1.29 JN.1.49.1 BF.42 BA.4.1.10 JN.3.2.1 GA.9 B.1.177.34 JN.1.7.6 A.2.5 BF.7.4.2 XAW AY.31 JN.1.50.1 XD	0.53889132 0.14267009 0.10553701 0.09792180 0.08737592 0.01315104 0.00631693 0.00412788 0.00072088 0.00050810 0.00050810 0.00043478 0.00031511 0.00027513 0.00019163 0.00014449 0.00011388 0.00011330 0.00009967 0.00008884 0.00006712 0.00006269 0.00006114 0.00005344 0.00004636 0.00004203 0.00003912 0.00003781 0.00003617 0.00003198 0.00001610 0.00000012 0.00000004 0.00000003 0.00000002 0.00000002 0.00000001 0.00000001 0.00000001	6.7473771904361435	96.52877637695215
